registro_ans,cnpj,razao_social,status
324248,1066931000155,FALÊNCIA DE - NANUBI PARTICIPAÇÕES E REPRESENTAÇÕES LTDA.,cancelado
380962,2548349000198,FALÊNCIA DE - ODONTO NORTE MEDICINA DE GRUPO LTDA,cancelado
356905,65050312000155,FALÊNCIA DE - PINDAMED SOCIEDADE CIVIL LTDA.,cancelado
411299,3715340000197,FALÊNCIA DE - PLANOS DE ASSISTÊNCIA MÉDICA E ODONTOLÓGICA MAIS SAÚDE LTDA.,cancelado
316423,92950161000164,FALÊNCIA DE - SERVIÇOS MÉDICOS A INDUSTRIA E COMÉRCIO LTDA.,cancelado
412651,2150598000120,FALÊNCIA DE - SIS SISTEMAS INTERATIVOS DE SAUDE,cancelado
414409,4288324000128,FALÊNCIA DE - TOP CARE SAUDE LTDA.,cancelado
408433,3004638000199,FALÊNCIA DE - VITÓRIA SERVIÇOS DE SAÚDE LTDA.,cancelado
407470,2499495000170,FALÊNCIA DE ABRASP EMPREENDIMENTOS ADMINISTRADORA DE BENEFÍCIOS S/C LTDA,cancelado
319341,27678911001524,"FALÊNCIA DE ADRESS ADM., REPRES. DE SISTEMAS DE SAUDE LTDA ",cancelado
340642,52370152000180,FALÊNCIA DE AME ASSISTÊNCIA MÉDICA AS EMPRESAS  LTDA,cancelado
374679,39615315000189,FALÊNCIA DE AMEP ASSISTENCIA MEDICA PLANEJADA LTDA. ,cancelado
350508,87784948000163,FALÊNCIA DE AMIC ASSISTÊNCIA MÉDICA INTEGRADA SC LTDA ,cancelado
387622,387203000182,FALÊNCIA DE ASSITALIA ASSITENCIA MEDICA S/C LTDA,cancelado
394009,66866146000122,FALÊNCIA DE AVICCENA ASSISTÊNCIA MÉDICA  LTDA. ,cancelado
344877,2908125000140,FALÊNCIA DE CANP SAUDE S/S LTDA,cancelado
303828,67666248000167,FALÊNCIA DE CEMEDKA PLANOS DE ASSISTENCIA MÉDICA S/C LTDA,cancelado
409553,3458260000101,FALÊNCIA DE CLASSIC SAUDE LTDA,cancelado
400955,16560096000182,FALÊNCIA DE CLIDEME ASSISTÊNCIA MÉDICO-DENTÁRIA S/C LTDA ,cancelado
323845,68809755000175,FALÊNCIA DE CLIMOJ - ASSISTÊNCIA MÉDICA DE JACAREPAGUÁ LTDA ,cancelado
411370,3383780000194,FALÊNCIA DE CODEB - COOPERATIVA DOS EVANGÉLICOS DE BELÉM ,cancelado
386375,49461320000138,FALÊNCIA DE CRISTO REI SAUDE ASSISTENCIA MÉDICA S/C LTDA. ,cancelado
414166,4517426000178,FALÊNCIA DE ESSENCIAL SISTEMA DE SAÚDE S/C LTDA. ,cancelado
317403,39468392000153,FALÊNCIA DE GLOBAL ASSISTENCIA MEDICA S/C ,cancelado
305600,60680865000178,FALÊNCIA DE INTERCLÍNICAS PLANOS DE SAÚDE S/A ,cancelado
408387,3365150000197,FALÊNCIA DE INTERSAU SERVIÇOS MÉDICOS LTDA,cancelado
402958,3052349000165,FALÊNCIA DE MAXIMED OPERADORA DE PLANOS DE SAUDE LTDA. ,cancelado
412392,2155017000143,FALÊNCIA DE MED PROG - MEDICINA PROGRAMADA LTDA. ,cancelado
322806,1978935000100,FALÊNCIA DE MEDPLAN - SERVIÇOS MÉDICOS E ODONTOLÓGICOS LTDA. ,cancelado
410535,1654046000197,FALÊNCIA DE MEDPLAN ASSISTÊNCIA E SAÚDE,cancelado
406732,3279823000196,FALÊNCIA DE MJA ASSISTÊNCIA MEDICA LTDA. ,cancelado
403881,3099779000132,FALÊNCIA DE NOTA ADMINISTRAÇÃO E PARTICIPAÇÃO LTDA ,cancelado
408441,3248157000129,FALÊNCIA DE ODONTO-SAÚDE ASSISTÊNCIA ODONTOLÓGICA S/C LTDA,cancelado
350621,56359284000161,FALÊNCIA DE PAZ MED PLANO DE SAUDE S/C LTDA.,cancelado
342220,68789577000168,FALÊNCIA DE PLANO DE ASSISTENCIA MÉDICA MILLER LTDA. ,cancelado
403954,68014695000102,FALÊNCIA DE PLANO DE SAÚDE SANTISTA S/C LTDA ,cancelado
356522,16098535000187,FALÊNCIA DE POLIMÉDICA - ASSISTÊNCIA MÉDICA LTDA ,cancelado
313220,4151320000101,FALÊNCIA DE PROTEÇÃO E ASSISTÊNCIA MÉDICA À SAÚDE S/S LTDA,cancelado
411949,11735842000108,FALÊNCIA DE PRUDENT CONSULTÓRIOS ODONTOLÓGICOS LTDA ,cancelado
401307,27449073000111,FALÊNCIA DE SAMEG - SERVIÇO DE ASSISTENCIA MÉDICA DE GRUPO LTDA. ,cancelado
413526,4312346000186,FALÊNCIA DE SAUDE CLAN LTDA,cancelado
410896,2941397000141,FALÊNCIA DE SAUDE EXCLUSIV ASSISTÊNCIA MÉDICA S/C LTDA,cancelado
412368,4010572000102,FALÊNCIA DE SAUDE PLUS ASSISTENCIA MEDICA  LTDA ,cancelado
353248,58623562000171,FALÊNCIA DE SAUDE UNICOR ASSISTENCIA MÉDICA LTDA.,cancelado
399442,29418951000167,FALÊNCIA DE SAVE ASSISTENCIA MEDICA E HOSPITALAR S/C LTDA.,cancelado
405337,1758263000127,FALÊNCIA DE SERVI SAÚDE ASSISTÊNCIA MÉDICA LTDA,cancelado
348767,27840065000100,FALÊNCIA DE SMB SISTEMA MEDICO BRASILEIRO LTDA,cancelado
408239,736862000187,FALÊNCIA DE TOI - TRATAMENTO ODONTOLÓGICO INTEGRADO LTDA.,cancelado
391298,25468687000115,FALÊNCIA DE TRANSCLINICA LTDA ,cancelado
319988,2563730000126,FALÊNCIA DE VITA SAUDE LTDA ,cancelado
406686,1472230000116,FALÊNCIA DE W ODONTO WEINGAERTNER COMÉRCIO E ADMINISTRAÇÃO LTDA.,cancelado
333638,62492053000124,FAMED ASSISTENCIA MEDICA LTDA,cancelado
412902,4106651000111,FAMIDENTE DE TERESOPOLIS PRESTAÇÃO DE ASSISTÊNCIA ODONTOLÓGICA,cancelado
402401,3008647000158,FAMILY MED ADMINISTRAÇÃO EM SAÚDE S/C LTDA.,cancelado
38466,17186115000115,FARMACIA SANTA MARTA LTDA,cancelado
334260,980583000164,FAVARO ASSISTENCIA ODONTOLOGICA S/C LTDA.,cancelado
35845,68529007000139,FEDERAÇAO DA UNIODONTO DA REGIAO CENTRAL DO BRASIL,cancelado
301051,146850000100,FEDERAÇAO DAS COOP. ODONT. DO ESTADO DE SANTA CATARINA,cancelado
332755,83311050000117,FEDERAÇAO DAS SOCIEDADES COOPERATIVA DE TRABALHO MÉDICO DO P,cancelado
344583,1182248000183,FEDERAÇÃO DAS UNIODONTOS DO ESTADO DE MINAS GERAIS,cancelado
363944,19891852000144,FEDERAÇÃO INTERFEDERATIVA DAS COOPERATIVAS DE TRABALHO MÉDICO DO ESTADO DE MINAS GERAIS,cancelado
358100,19443985000158,FERTILIZANTES FOSFATADOS S/A - FOSFERTIL,cancelado
350761,60398989000165,FERTILIZANTES SERRANA S/A,cancelado
348929,2489022000192,FIAMM SOGEFI BUZINAS LTDA.,cancelado
404004,73847253001060,FICAP S A,cancelado
303097,839627000130,FICOSA DO BRASIL LTDA,cancelado
353345,57014862000190,FILTROS MANN LTDA.,cancelado
337404,28954717000191,FIOPREV - INSTITUTO OSWALDO CRUZ DE SEGURIDADE SOCIAL,cancelado
402257,73267999000103,FIRST ASSESSORIA E ASSISTÊNCIA ODONTOLÓGICA S/C LTDA,cancelado
318744,1444998000186,FISIODENTE CONSULTORIA E ASSESSORIA EM GESTÃO EMPRESARIAL LTDA. EPP.,cancelado
382213,18032250000179,FLENDER BRASIL LTDA,cancelado
315354,57290355000180,FORD BRASIL,cancelado
40140,2290521000156,FORTALEZA SAUDE BUCAL SC LTDA,cancelado
304018,105388000195,FORTSAUDE ASSISTENCIA MÉDICA LTDA,cancelado
422495,36517218000165,FOX OPERADORA DE PLANOS DE SAUDE EIRELI,cancelado
405311,1941126000123,FRANCISCON E MARTIN & CIA S/C LTDA,cancelado
40570,3218890000109,FRANÇA BERNIZ ODONTOLOGIA S/C LTDA.,cancelado
406830,2398666000175,FREE DENT PLANOS E ASSISTÊNCIA ODONTOLÓGICA S/C LTDA,cancelado
405248,76026699000120,FREE DENT PLANOS ODONTÓLOGICOS LTDA,cancelado
351091,2877955000157,FREE LIFE OPERADORA DE PLANOS DE SAÚDE LTDA,cancelado
364371,76629252000146,FUNBEP - FUNDO DE PENSÃO MULTIPATROCINADO,cancelado
306991,17213901000164,FUNDACAO SIDERTUBE,cancelado
379379,27820000000194,FUNDAÇAO ASSISTENCIAL BRAHMA,cancelado
34803,43302025000233,FUNDAÇAO BRASINCA UNIDADE I,cancelado
321699,11722691000153,FUNDAÇAO CELPE DE SEGURIDADE SOCIAL,cancelado
31193,78071602000127,FUNDAÇAO CORNELIUS MARIUS HORSMAN,cancelado
30833,81917817000120,FUNDAÇAO CULTURAL LEONARDO DA VINCI,cancelado
367877,19740471000164,FUNDAÇAO DOS EMPREGADOS DA FIAT,cancelado
315095,42286245000177,FUNDAÇAO ELETROSUL DE PREVIDÊNCIA E ASSISTÊNCIA SOCIAL ELOS,cancelado
356573,41343187000103,FUNDAÇAO OTÍLIA CORREIA SARAIVA,cancelado
362590,76693761000138,FUNDAÇAO TELEPAR,cancelado
378780,419499000176,FUNDAÇAO TRANSBRASIL,cancelado
303151,59995621000103,FUNDAÇAO VÉRITAS,cancelado
302881,17989187000109,FUNDAÇÃO ASSISTENCIAL VIÇOSENSE,cancelado
304913,78242559000115,FUNDAÇÃO BATAVO,cancelado
311499,27836329000143,FUNDAÇÃO BENEFICENTE RIO DOCE,cancelado
400521,66227489000147,FUNDAÇÃO CARATINGUENSE DE SAÚDE,cancelado
338273,83477901000104,FUNDAÇÃO CASAN - FUCAS,cancelado
369012,1204105000125,FUNDAÇÃO DE AMPARO SOCIAL DO HOSPITAL MOINHOS DE VENTO,cancelado
390372,6676977000100,FUNDAÇÃO DE ASSISTÊNCIA DOS FUNCIONÁRIOS DO BANCO BEM S/A,cancelado
309362,469585000193,FUNDAÇÃO DE PREVIDÊNCIA DOS EMPREGADOS DA CEB,cancelado
384828,2291134000134,FUNDAÇÃO DE SAÚDE SOLIDÁRIA ,cancelado
345211,7222847000160,FUNDAÇÃO DR. ANTONIO DIAS MACÊDO,cancelado
339547,17178203000175,FUNDAÇÃO EDUCACIONAL LUCAS MACHADO,cancelado
313904,34268789000188,FUNDAÇÃO ELETROBRÁS DE SEGURIDADE SOCIAL - ELETROS,cancelado
374326,33122029000103,FUNDAÇÃO ENERSUL,cancelado
414361,31738040000169,FUNDAÇÃO ESCELSA DE SEGURIDADE SOCIAL - ESCELSOS,cancelado
300497,16539926000190,FUNDAÇÃO FORLUMINAS DE SEGURIDADE SOCIAL,cancelado
408514,20146064000102,FUNDAÇÃO GERALDO CORREA,cancelado
400441,88263686000154,FUNDAÇÃO HOSPITALAR EDUCACIONAL E SOCIAL DE PORTÃO,cancelado
40084,64486566000239,FUNDAÇÃO IGUATAMENSE PARA A SAÚDE E EDUCAÇÀO,cancelado
301221,40425332000132,FUNDAÇÃO INEPAR,cancelado
40071,33781055000135,FUNDAÇÃO OSWALDO CRUZ,cancelado
413399,47074851000142,FUNDAÇÃO PADRE ALBINO,cancelado
408069,7177769000129,FUNDAÇÃO PADRE IBIAPINA,cancelado
350257,48032700000194,FUNDAÇÃO PREFEITO FARIA LIMA- CEPAM,cancelado
353922,47415773000100,FUNDAÇÃO PROMON DE PREVIDÊNCIA SOCIAL,cancelado
406597,920528000189,FUNDAÇÃO RAUL CLEMENTE PEREIRA,cancelado
336165,65471914000186,FUNDAÇÃO SABESP DE SEGURIDADE SOCIAL - SABESPREV,cancelado
415588,59107300000117,FUNDAÇÃO SALVADOR ARENA,cancelado
415405,5202699000196,FUNDAÇÃO SANTA CASA DE MISERICÓRDIA DE BELO HORIZONTE,cancelado
411850,345515000123,"FUNDAÇÃO SINTAF - SAÚDE DE ASSISTÊNCIA AOS SERVIDORES DO GRUPO TRIBUTAÇÃO, ARRECADAÇÃO E FISCALIZAÇÃO DA SECRETARIA DE ESTADO DA FAZENDA DO ",cancelado
370525,493916000120,FUNDAÇÃO SISTEL DE SEGURIDADE SOCIAL,cancelado
406953,81652737000190,FUNDAÇÃO SOKOLSKI NZ,cancelado
417246,11508880000128,FUNDAÇÃO USISAÚDE,cancelado
319147,56893209000186,FUNDAÇÃO WALDEMAR BARNSLEY PESSOA,cancelado
405175,2025491000150,FUNDO DE ASSISTENCIA A SAUDE - FAS,cancelado
413992,3203113000182,FUNDO DE ASSISTENCIA A SAUDE DOS CONTABILISTAS DO PARANA,cancelado
340065,62576327000163,FUPRESA S/A,cancelado
366455,23274194000119,FURNAS CENTRAIS ELÉTRICAS S.A.,cancelado
420204,23984844000110,G L PARTICIPAÇÕES E ADMINISTRAÇÃO DE BENS LTDA.,cancelado
411957,3356804000116,G.SAÚDE ADMINISTRADORA DE PLANOS DE SAÚDE LTDA.,cancelado
423025,42809752000148,G1 ADMINISTRADORA DE BENEFICIOS LTDA,cancelado
409197,29411345000110,GAMA ODONTO S/A.,cancelado
401021,65169997000153,GAMA ODONTOLOGIA INTEGRADA CIA LTDA,cancelado
35622,2741889000193,GARANTIA DE SAUDE OPER.PLA.SAUDE DO HOSP.ADVENTISTA DE BELÉM,cancelado
418579,4114802000183,GARCIA DOURADO ODONTOLOGIA LTDA,cancelado
371891,43434471000110,GARDEN GESTÃO DE ASSISTÊNCIA E REABILITAÇÃO DENTÁRIA LTDA,cancelado
33613,1772666000120,GAS PONTUAL LTDA,cancelado
403326,1868716000178,GBAM EMPRESARIAL ADM. DE SERVIÇOS MÉDICOS S/C LTDA,cancelado
407895,3025852000121,GEDEAM CAMPELO NUNES,cancelado
408751,1677991000104,GEEO QUALITY DENT GRUPO EMPRESARIAL E ODONTÓLIGOS LTDA.,cancelado
5649,33016254000157,GENERAL ACCIDENT CIA DE SEGUROS,cancelado
5908,33072307000157,GENERALI DO BRASIL CIA NACIONAL DE SEGS,cancelado
328774,94392016000130,GENTE CLUBE DE VIDA - PROMOÇÕES E SERVIÇOS SOCIEDADE SIMPLES LTDA.,cancelado
6793,90180605000102,GENTE SEGURADORA S/A,cancelado
403938,2453251000157,GEOVANE PEREIRA MENDONCA & CIA LTDA,cancelado
418544,14302787000150,GESTAF - ADMINISTRAÇÃO DE BENEFICIOS LTDA ME,cancelado
372811,2932060000178,GESTÃO PROPRIA DE SAUDE S/C LTDA,cancelado
419176,2991601000139,GESTÃO SAÚDE - COOPERATIVA  NACIONAL DAS COOPERATIVAS DE USUÁRIOS DE ASSISTÊNCIA MÉDICA,cancelado
417262,10897869000134,"GESTÃO SERVIÇOS DE INTERMEDIAÇÃO, AGENCIAMENTO E NEGÓCIOS LTDA",cancelado
309711,68059674000103,GEVISA S/A,cancelado
413097,1771949000158,GIGLIO & LEITE ODONTOLOGIA ESPECIALIZADA S/C LTDA.,cancelado
414786,4490850000176,GILLETTE DO BRASIL LTDA.,cancelado
414271,52618139000105,GL ELETRO-ELETRÔNICOS LTDA,cancelado
400459,2019772000109,GLAUCIO LUCIANO FERREIRA BAPTISTA,cancelado
40116,491736000100,GLOBAL ASSISTÊNCIA MÉDICA LTDA.,cancelado
420760,25085080000156,GLOBAL SORRISO ODONTOLOGIA LTDA.,cancelado
412848,4101252000168,GLOBAL UBERABA EMPREENDIMENTOS LTDA,cancelado
315737,46339347000164,GOI - GRUPO ODONTOLOGICO INTEGRADO,cancelado
404799,3035055000125,GOIÂNIA CARD LTDA,cancelado
6971,36155208000127,GOLDEN CROSS SEGURADORA S/A,cancelado
365921,2784310000170,GOLDEN LIFE SISTEMA DE SAÚDE LTDA,cancelado
401331,714539000102,GOLDEN SUL PLANOS DE SAÚDE LTDA-ME,cancelado
305995,65140725000120,GOOD LIFE SAUDE LTDA - EM LIQUIDAÇÃO EXTRAJUDICIAL,cancelado
404659,2788433000189,GOSPEL ASSESSORIA E CLINICAS ODONTOLOGICAS S/C LTDA,cancelado
402494,1707505000153,GOTI GRUPO ODONTOLOGICO DE TRATAMENTO INTEGRADO LTDA,cancelado
299,175304000190,GRALHA AZUL SAÚDE S.A.,cancelado
304620,175304000190,GRALHA AZUL SERVIÇOS DE SAUDE S/C LTDA.,cancelado
403521,39464516000122,GRAM RIO ASSISTÊNCIA MÉDICA S/C LTDA.,cancelado
409375,3402221000184,GRANDE LAGOS S/C LTDA,cancelado
404152,92193135000139,GRANJAS QUATRO IRMÃOS AGROPECUÁRIA E COMÉRCIO S/A,cancelado
410519,1158845000172,GRAO ASSISTÊNCIA ODONTOLÓGICA LTDA.,cancelado
410471,3571385000135,GREEN LIFE SAÚDE ASSISTÊNCIA MÉDICA LTDA.,cancelado
325074,61849980000196,GREEN LINE SISTEMA DE SAÚDE S.A,cancelado
350206,81485153000178,GREMIO BENEFICENTE DOS EMPREGADOS DE KLABIN S/A,cancelado
310638,47786801000198,GREMIO DOS SUBTENENTES E SARGENTOS DAS FORCAS ARMADAS DA BAIXADA,cancelado
407364,1648202000107,GRUMEQ - GRUPO MÉDICO ODONTOLOGICO CIRURGICO DE QUEIMADOS LTDA.,cancelado
404926,562846000115,GRUPO DE ASSESSORIA ODONTOLÓGICA TOTAL LTDA,cancelado
409952,52634201000144,GRUPO DE ASSISTÊNCIA ODONTOLÓGICA MGO S/C LTDA,cancelado
409910,52384492000160,GRUPO ODONTOLOGICO DR.VICTORIO ABDALLA LTDA,cancelado
391727,11140431000170,GRUPO SERVIÇOS DE MEDICINA LTDA,cancelado
419672,11030551000114,GSI - ADMINISTRADORA DE BENEFÍCIOS LTDA - EPP,cancelado
412180,29529633000173,GTEC PRODUÇÃO E VIDEOCOMUNICAÇÃO LTDA.,cancelado
348040,93204022000154,GUAIBA SERVICE - ADMINISTRAÇAO E REPRESENTAÇOES LTDA.,cancelado
360490,688971000176,GUARUDONTO PLANOS ODONTOLÓGICOS S/C LTDA - ME,cancelado
338591,19596170000109,GV CLINICAS ASSISTENCIA MEDICA ESPECIALIZADA LTDA,cancelado
419893,12643794000190,GÁVEA GESTÃO EM PLANOS DE SAÚDE S.A.,cancelado
307629,2854740000110,H. S. SOBRASA SAÚDE LTDA,cancelado
419834,22103771000147,HALSA OPERADORA DE MEDICINA DE GRUPO LTDA - EM LIQUIDAÇÃO EXTRAJUDICIAL,cancelado
422444,37179657000178,HAPPYMED PLANO DE SAÚDE LTDA,cancelado
406180,31245210000173,HAWAII TROPICAL HOTÉIS CLUB,cancelado
417637,9555697000131,HEALTH CLUB ADMINISTRADORA DE BENEFÍCIOS,cancelado
420182,25066872000183,HEALTH CLUB ADMINISTRADORA DE BENEFÍCIOS LTDA.,cancelado
412031,2910572000133,HEALTHCARD ADMINISTRADORA DE CARTOES E SERVICOS LTDA,cancelado
414441,3639079000193,HEALTHCARE TRUST SERVICE - CONSULTORIA EM NEGÓCIOS DE SAÚDE,cancelado
408221,3359672000186,HELPMEDICA ASSISTENCIA MEDICA LTDA.,cancelado
326542,89411771000185,HEWLETT PACKARD BRASIL S/A,cancelado
404136,19402023000150,HG - PARTICIPAÇÕES  E EMPREENDIMENTOS  LTDA.,cancelado
414476,59491720000140,HIPERMED ASSISTÊNCIA MÉDICA LTDA.,cancelado
375101,33468679001845,HOECHST MARION ROUSSEL,cancelado
403555,2130661000167,HOKKEN MED PROJETOS E ADMINISTRAÇÃO EM SAÚDE S/C LTDA.,cancelado
322903,93921666000163,HOLOS SAÚDE E AMBIENTE CONSULTORES ASSOCIADOS S/C LTDA.,cancelado
38369,70134150000173,HOSPITAIS E CLINICAS ASSOCIADOS DA PARAIBA S/C LTDA,cancelado
404314,16530495000109,HOSPITAIS REUNIDOS S/A,cancelado
400653,60884855000154,"HOSPITAL ""9 DE JULHO"" S/A",cancelado
40219,20351540000127,HOSPITAL COMUNITARIO DE LARANJAL,cancelado
401188,88239074000126,HOSPITAL DE CARIDADE DE CANGUÇU,cancelado
357405,96136643000136,HOSPITAL DE CARIDADE DE SANTIAGO,cancelado
363111,72863665000130,HOSPITAL DE CARIDADE DE VARGEM GRANDE DO SUL,cancelado
349917,95610887000146,HOSPITAL DE CARIDADE DR. ASTROGILDO DE AZEVEDO,cancelado
39550,87768735000148,HOSPITAL DE CARIDADE E BENEFICIENCIA,cancelado
400319,19529478000131,HOSPITAL DE CATAGUASES,cancelado
35905,22027320000178,HOSPITAL DE CLINICAS DO TRIANGULO LTDA,cancelado
311065,32292815000188,HOSPITAL DE CLINICAS Nª. Sª. DA CONCEIÇÃO,cancelado
409511,33310681000143,HOSPITAL DE CLÍNICAS QUARTO CENTENÁRIO DO RIO DE JANEIRO S/C,cancelado
407691,3123173000195,HOSPITAL DE CLÍNICAS VINTE E CINCO DE DEZEMBRO LTDA.,cancelado
35118,634886000125,HOSPITAL E MATERNIDADE AMÉRICA S/C LTDA,cancelado
406503,44402675000132,HOSPITAL E MATERNIDADE CENTRAL LTDA.,cancelado
300420,60875226000168,HOSPITAL E MATERNIDADE NOSSA SENHORA DE LOURDES SA,cancelado
350222,50486026000160,HOSPITAL E MATERNIDADE SÃO JOAQUIM LTDA,cancelado
400734,19715663000110,HOSPITAL E MATERNIDADE SÃO JOSÉ,cancelado
301736,71908818000155,HOSPITAL E MATERNIDADE SÃO SEBASTIÃO LTDA,cancelado
355623,54935614000194,HOSPITAL E MATERNIDADE TALITA S/C LTDA,cancelado
301043,32491672000133,HOSPITAL EVANGELICO REGIONAL LTDA,cancelado
414956,2608131000181,HOSPITAL EVANGÉLICO DE RIO VERDE,cancelado
330876,16881161000171,HOSPITAL IMACULADA CONCEIÇÃO,cancelado
374237,33543356002093,HOSPITAL MAICÉ,cancelado
392391,81564346000114,HOSPITAL MARECHAL CÂNDIDO RONDON LTDA. ,cancelado
412023,84100189000184,HOSPITAL MATERNIDADE E LABORATÓRIO FLEMING LTDA,cancelado
315681,51612828000131,HOSPITAL MATERNIDADE FREI GALVAO,cancelado
378666,18191213000103,HOSPITAL MATERNIDADE SÃO LUCAS LTDA,cancelado
409626,2995042000135,HOSPITAL MATERNIDADE SÃO THIAGO LTDA.,cancelado
332518,84703248000109,HOSPITAL MUNICIPAL SAO JOSÉ/SERVI-SAUDE,cancelado
309401,20600763000180,HOSPITAL NOSSA SENHORA DAS GRAÇAS LTDA.,cancelado
407178,24731747000188,HOSPITAL NOSSA SENHORA DAS MERCÊS,cancelado
329525,52956901000155,HOSPITAL NOVO ATIBAIA S/A,cancelado
415995,826951000114,HOSPITAL ODONTOLOGICO LTDA.,cancelado
406643,89431092000178,HOSPITAL OSWALDO CRUZ LTDA,cancelado
406457,22296115000108,HOSPITAL PADRE JÚLIO MARIA,cancelado
309338,68392604000164,HOSPITAL REGIONAL DE FRANCA S/A,cancelado
333034,72052350000102,HOSPITAL S F DA IR DA SANTA CASA DE MISERICORDIA DE TAMBAU,cancelado
337714,50385384000186,HOSPITAL SAO MARCOS S/A,cancelado
411141,31317035000182,HOSPITAL SÃO LOURENÇO LTDA.,cancelado
400629,46009718000140,HOSPITAL VERA CRUZ S/A.,cancelado
33808,92694546000108,HOTÉIS ITAPUAN - REDE CITY HOTEL,cancelado
5541,33425075000173,HSBC SEGURO SAÚDE S.A.,cancelado
6106,76538446000136,HSBC SEGUROS (BRASIL) S/A,cancelado
411078,3618615000174,HSBC SERVIÇOS DE SAÚDE S/C,cancelado
369373,73717639000166,HUMANA SAÚDE SUL LTDA.,cancelado
5142,42283770000139,ICATU HARTFORD SEGUROS S.A,cancelado
348813,90285958000169,ICOTRON INDÚSTRIA DE COMPONENTES ELETRÔNICOS LTDA,cancelado
402303,2705451000150,IDEAL PARTICIPAÇÕES LTDA,cancelado
358240,1785546000168,IDEAL SAÚDE PLANO DE ASSISTÊNCIA ODONTOLÓGICA LTDA.,cancelado
420310,24622429000189,IDENTS PLANOS ODONTOLÓGICOS LTDA.,cancelado
336084,86552809000141,IEAS - INSTITUTO DE ENSINO E ASSISTÊNCIA SOCIAL,cancelado
357987,47855507000190,IGARATIBA INDÚSTRIA E COMÉRCIO LTDA,cancelado
354589,1486628000101,IGEL S.A. EMBALAGENS,cancelado
419664,20731941000102,IGM ADMINISTRADORA DE BENEFÍCIOS LTDA-ME,cancelado
419745,21415709000128,IGM OPERADORA DE PLANOS ODONTOLÓGICOS LTDA,cancelado
320790,1536065000119,IGUAMED ASSISTÊNCIA MÉDICA LTDA,cancelado
372765,61066460000107,IIMC-INSTITUTOS INTEGRADOS DE MEDICINA E CIRURGIA S/C LTDA.,cancelado
34019,18751883000137,IKERA- INDUSTRIA E COMÉRCIO LTDA,cancelado
415138,4785761000157,ILHÉUS-MED OPERADORA DE PLANOS DE SAÚDE - VIDAMEDI LTDA. - LIQUIDAÇÃO EXTRAJUDICIAL ENCERRADA,cancelado
316784,47014345000168,IMO-INSTITUTO MÉDICO E ODONTOLOGICO S/C LTDA.,cancelado
417670,10606510000160,IMPERIAL SAÚDE ASSISTÊNCIA MÉDICA LTDA.,cancelado
366170,65703365000128,IMPERIOS ASSESSORIA SOCIAL S/C LTDA.,cancelado
413925,65703365000128,IMPÉRIOS ASSESSORIA SOCIAL S/C LTDA,cancelado
386359,57000036000192,INA BRASIL LTDA,cancelado
317373,76610062000187,INCEPA REVESTIMENTOS CERAMICOS LTDA,cancelado
421481,27295956000114,INCREMENTA ADMINISTRADORA DE BENEFICIOS LTDA,cancelado
339008,274517000179,INCREMENTAL ODONTOLOGIA S/S LTDA.,cancelado
377988,94820123000112,IND. CANGURU EMBALAGENS RIOGRANDENSE,cancelado
408301,51282259000103,INDA CLINICA S/C LTDA,cancelado
317802,17225913000109,INDUSTRIA E COMÉRCIO KODAMA LTDA,cancelado
343901,88941125000167,INDUSTRIAL HAHN FERRABRAZ LTDA.,cancelado
342530,88301163000155,INDUSTRIAS MICHELETTO S.A.,cancelado
343871,50080092000135,INDÚSTRIA MÊCANICA SIGRIST LTDA,cancelado
422819,41452527000134,INFINITY PLANOS DE SAUDE INTEGRADO LTDA ,cancelado
411043,2666970000156,INFONET- INFORMATICA DE PRAIA GRANDE LTDA,cancelado
359092,49336860000190,ING BANK,cancelado
357626,1999166000126,INNOVA S.A,cancelado
318558,129441000198,INSOLVÊNCIA CIVIL DA UNIMED METROPOLITANA DE SALVADOR - COOP TRAB MEDICO,cancelado
414417,5063699000152,INSOLVÊNCIA CIVIL DE - ALIANÇA METROPOLITANA RJ COOPERATIVA DE TRABALHO MÉDICO,cancelado
371904,2910011000134,INSOLVÊNCIA CIVIL DE - UNIMED LITORAL SUL PAULISTA,cancelado
353728,2862873000139,INSOLVÊNCIA CIVIL DE ALIANÇA COOPERATIVISTA NACIONAL UNIMED - CONFEDERAÇAO DE COOPERATIVAS MÉDICAS,cancelado
416304,5256845000166,"INSOLVÊNCIA CIVIL DE ASSOCIAÇÃO ASSIT E EM DEFESA DOS DIREITOS DOS COM., IND. AUT. E TRAB EM GERAL",cancelado
414913,81140873000100,INSOLVÊNCIA CIVIL DE ASSOCIAÇÃO DE ASSISTÊNCIA À SAÚDE DOS SERVIDORES PÚBLICOS DO MUNICÍPIO DE JOINVILLE,cancelado
418854,15787592000100,INSOLVÊNCIA CIVIL DE ASSOCIAÇÃO METROPOLITANA DE ASSISTÊNCIA À SAÚDE,cancelado
347388,2899876000147,INSOLVÊNCIA CIVIL DE BIO MED - ASSISTENCIA MÉDICA S/C LTDA. ,cancelado
308081,62440185000102,INSOLVÊNCIA CIVIL DE CENTRO BENEFICENTE DOS MOTORISTAS DE SÃO PAULO,cancelado
413674,3850743000149,INSOLVÊNCIA CIVIL DE COOPERATIVA DE CONSUMO GESTÃO E SERVIÇOS DE SAÚDE - COOPESAÚ,cancelado
338559,7142821000101,INSOLVÊNCIA CIVIL DE COOPERATIVA DE TRABALHO MÉDICO DE SÃO LUÍS LTDA. - UNIMED DE SÃO LUÍS,cancelado
314170,152753000112,INSOLVÊNCIA CIVIL DE COOPERATIVA DE USUÁRIOS ASSISTÊNCIA MÉDICO-HOSPITALAR LTDA - VIVAMED SAÚDE,cancelado
411272,3617134000144,INSOLVÊNCIA CIVIL DE COOPERATIVA DE USUÁRIOS DE ASSISTÊNCIA MEDICO-HOSPITALAR E ODONTOLÓGICA - USIMED ,cancelado
377368,1306022000147,INSOLVÊNCIA CIVIL DE COOPERBRAS COOPERATIVA DOS PROFISSIONAIS DA SAUDE,cancelado
310581,2146566000151,INSOLVÊNCIA CIVIL DE COOPTASIM-ES -  COOPERATIVA DE PROFISSIONAIS TÉCNICOS NA ADMINISTRAÇÃO DE SERV EVANGELICOS DO EST DO ESPIRITO SANTO,cancelado
358720,431403000195,INSOLVÊNCIA CIVIL DE FUNDAÇÃO ASSISTENCIAL DOS SERVIDORES DO INCRA - FASSINCRA ,cancelado
419044,18325880000131,INSOLVÊNCIA CIVIL DE FUNDAÇÃO IRMÃO DIAMANTINO,cancelado
416924,9483741000145,INSOLVÊNCIA CIVIL DE INSTITUTO DE ASSISTÊNCIA À SAÚDE DOS SERVIDORES PÚBLICOS MUNICIPAIS,cancelado
342408,1591800000197,INSOLVÊNCIA CIVIL DE PAME - ASSOCIAÇÃO DE ASSISTÊNCIA PLENA EM SAÚDE - EM LIQUIDAÇÃO EXTRAJUDICIAL,cancelado
420263,26143531000127,INSOLVÊNCIA CIVIL DE SEMPRE SAÚDE ADMINISTRADORA DE BENEFÍCIOS,cancelado
312304,33909540000141,INSOLVÊNCIA CIVIL DE SERVIÇO SOCIAL DAS ESTRADAS DE FERRO - SESEF,cancelado
315630,211378000134,INSOLVÊNCIA CIVIL DE SOCIAL-SOCIEDADE ASSISTENCIAL E CULTURAL,cancelado
356107,45198009000197,INSOLVÊNCIA CIVIL DE SOCIEDADE COOPERATIVA CRUZEIRO - OPERADORA DE PLANOS DE SAUDE SOCIEDADE COOPERATIVA,cancelado
404594,3013887000140,INSOLVÊNCIA CIVIL DE TK PLANO DE ASSISTENCIA ODONTOLOGICA S/C LTDA ,cancelado
353574,510909000190,INSOLVÊNCIA CIVIL DE UNIMED BRASILIA COOPERATIVA DE TRABALHO MÉDICO,cancelado
335835,40757874000102,INSOLVÊNCIA CIVIL DE UNIMED CAICO COOPERATIVA DE TRABALHO MEDICO,cancelado
348066,1029782000154,INSOLVÊNCIA CIVIL DE UNIMED DAS ESTÂNCIAS PAULISTAS - OPERADORA DE PLANOS DE SAÚDE SOCIEDADE COOPERATIVA,cancelado
317187,10693000000178,INSOLVÊNCIA CIVIL DE UNIMED DE CURRAIS NOVOS - SOC. COOP. DE TRABALHO MÉDICO ,cancelado
321036,13246905000198,INSOLVÊNCIA CIVIL DE UNIMED DE JEQUIÉ COOPERATIVA DE TRABALHO MÉDICO,cancelado
312509,1085378000106,INSOLVÊNCIA CIVIL DE UNIMED DE PAULO AFONSO COOPERATIVA DE TRABALHO MÉDICO,cancelado
341126,50617513000114,INSOLVÊNCIA CIVIL DE UNIMED DE SÃO PAULO COOPERATIVA DE TRABALHO MEDICO ,cancelado
348635,72518079000158,INSOLVÊNCIA CIVIL DE UNIMED DUQUE DE CAXIAS RJ COOPERATIVA DE TRAB. MÉDICO LTDA,cancelado
347361,1409581000182,INSOLVÊNCIA CIVIL DE UNIMED FEDERAÇÃO INTERFEDERATIVA DAS COOPERATIVAS MÉDICAS DO CENTRO-OESTE E TOCANTINS,cancelado
358231,696680000120,INSOLVÊNCIA CIVIL DE UNIMED INTRAFEDERATIVA FEDERAÇÃO METROPOLITANA DE SÃO PAULO,cancelado
366811,10225225000108,INSOLVÊNCIA CIVIL DE UNIMED MACAPA COOPERATIVA DE TRABALHO MÉDICO,cancelado
309427,40999724000105,INSOLVÊNCIA CIVIL DE UNIMED MACAU COOPERATIVA DE TRABALHO MEDICO,cancelado
333719,23511850000150,INSOLVÊNCIA CIVIL DE UNIMED PARNAÍBA - COOPERATIVA DE TRABALHO MÉDICO,cancelado
301337,43202472000130,INSOLVÊNCIA CIVIL DE UNIMED PAULISTANA SOCIEDADE COOPERATIVA DE TRABALHO MÉDICO,cancelado
301311,13130299000140,INSOLVÊNCIA CIVIL DE UNIMED SALVADOR COOPERATIVA DE TRABALHO MÉDICO,cancelado
407330,16404675000136,INSOLVÊNCIA CIVIL DE UNIMED SENHOR DO BONFIM - COOPERATIVA DE TRABALHO MÉDICO,cancelado
407062,42047191000197,INSOLVÊNCIA CIVIL DE UNIMED VALENÇA COOPERATIVA DE TRABALHO MÉDICO,cancelado
341215,73696718000138,INST. ADV. ESTE BRAS. DE PREV. E ASSIST. À SAÚDE,cancelado
404071,76726884004972,INSTITUIÇÃO ADV. SUL BRAS. DE EDUC. E ASSIST. SOCIAL,cancelado
414883,5923989000129,INSTITUTO ASSISTENCIAL MEDICO E ODONTOLÓGICO LTDA.,cancelado
417378,5999063000117,INSTITUTO BRASILEIRO DE BENEFICIOS PARA COOPERATIVAS E ASSOCIACOES,cancelado
367826,33155490000154,INSTITUTO CLINICO NOSSA SENHORA DE FATIMA LTDA,cancelado
317578,33558990000137,INSTITUTO CLÍNICO RIO GUANABARA LTDA,cancelado
350940,1645626000118,INSTITUTO DE ASSIST. MÉDICO-HOSPITALAR DOS FUNC. DA ALESC,cancelado
