registro_ans,cnpj,razao_social,status
419761,19541931000125,18 DE JULHO ADMINISTRADORA DE BENEFÍCIOS LTDA,ativo
421545,22869997000153,2B ODONTOLOGIA OPERADORA DE PLANOS ODONTOLÓGICOS LTDA,ativo
421421,27452545000195,2CARE OPERADORA DE SAÚDE LTDA.,ativo
418030,13138885000131,A.P.S. ADMINISTRADORA DE BENEFÍCOS LTDA.,ativo
314668,17505793000101,ABERTTA SAÚDE - ASSOCIAÇÃO BENEFICENTE DOS EMPREGADOS DA ARCELORMITTAL NO BRASIL,ativo
419621,17687511000126,ABPLUS ADMINISTRADORA DE BENEFÍCIOS LTDA.,ativo
418901,10458298000131,AD SALUTE ADMINISTRADORA DE BENEFÍCIOS LTDA,ativo
424293,58280182000181,ADC ADMINISTRADORA DE BENEFICIOS LTDA,ativo
421553,28315826000169,ADM LIFE - ADMINISTRADORA DE BENEFÍCIOS LTDA.,ativo
416932,7867825000157,ADMSERV BENEFÍCIOS E SERVIÇOS LTDA,ativo
422347,37201454000130,ADRESS ADMINISTRADORA DE BENEFICIOS LTDA,ativo
335657,2041808000142,ADVANCE PLANOS DE SAÚDE LTDA,ativo
413283,3694367000140,AESP ODONTO ASSISTÊNCIA ODONTOLÓGICA S/S LTDA EPP,ativo
417424,11158465000191,AFFIX ADMINISTRADORA DE BENEFÍCIOS LTDA,ativo
368920,20320487000105,AGROS - INSTITUTO UFV DE SEGURIDADE SOCIAL,ativo
424285,57522360000170,AIRES OPERADORA DE SAUDE LTDA,ativo
417742,10387254000168,ALACORÔ CASF ASSOCIAÇÃO CLUBE DE BENEFICIOS PESSOAIS E EMPRESARIAIS,ativo
421928,34266553000102,ALICE OPERADORA LTDA.,ativo
417289,7674593000110,ALL CARE ADMINISTRADORA DE BENEFÍCIOS SÃO PAULO LTDA,ativo
417459,11165556000154,ALLCARE ADMINISTRADORA DE BENEFÍCIOS EM SAÚDE LTDA.,ativo
515,4439627000102,ALLIANZ SAÚDE S/A,ativo
423262,45568546000181,ALMA ODONTO OPERADORA DE PLANOS ODONTOLOGICOS LTDA,ativo
419982,20459346000160,ALPHA DENTAL PLANO DE SAUDE LTDA ME,ativo
420255,22103116000199,ALTER ADMINISTRADORA DE BENEFICIOS S.A.,ativo
418773,16757674000175,ALUVES ADMINISTRADORA DE  BENEFICIOS LTDA,ativo
344800,62511019000150,ALVORECER - ASSOCIAÇÃO DE SOCORROS MÚTUOS,ativo
424234,56307500000125,AMAZIL ASSISTENCIA MEDICA DO BRASIL LTDA,ativo
419052,16926969000128,AMAZÔNIA PLANOS DE SAÚDE LTDA,ativo
423351,46614535000153,AME VVIDA PLANOS DE SAUDE INTEGRADO LTDA.,ativo
304531,17143876000190,AME-ASSISTÊNCIA MÉDICA A EMPRESAS LTDA,ativo
413330,4257073000114,AMEP FREGUESIA OPERADORA DE PLANO DE SAUDE LTDA,ativo
394734,67839969000121,AMEPLAN ASSISTÊNCIA MÉDICA PLANEJADA LTDA,ativo
401081,68668045000172,AMESC - ASSOCIAÇÃO MÉDICA ESPÍRITA CRISTÃ,ativo
418587,15131148000132,AMHA SAUDE S/A,ativo
421731,29174910000172,AMHE MED ASSISTENCIA A SAUDE LTDA - EPP,ativo
326305,29309127000179,AMIL ASSISTÊNCIA MÉDICA INTERNACIONAL S.A.,ativo
325465,20946877000187,AMPARA ASSISTÊNCIA MÉDICA PARAÍSO LTDA,ativo
422720,41077489000187,AMPLA PLANOS DE SAUDE LTDA,ativo
423858,43047552000168,AMPLITUDE PLANOS DE SAUDE LTDA ,ativo
424277,57395677000193,AMÉLIA OPERADORA DE PLANOS DE SAUDE S/A.,ativo
423319,45981176000100,ANAFE SAUDE,ativo
421871,3013779000178,ANGELI SISTEMAS DE SAUDE S.A.,ativo
424366,55081563000143,AP ADMINISTRAÇÃO DE BENEFICIOS - SOCIEDADE SIMPLES UNIPESSOAL LIMITADA,ativo
422932,35808498000106,APLUS ADMINISTRADORA DE BENEFICIOS LTDA,ativo
421693,30902499000193,AQQUER - ADMINISTRADORA DE BENEFÍCIOS LTDA,ativo
416070,17469701000177,ARCELORMITTAL BRASIL S/A,ativo
422941,41715325000138,ARL ADMINISTRADORA DE BENEFÍCIOS LTDA.,ativo
352152,743507000135,ARM PLANOS ODONTOLÓGICOS LTDA.,ativo
424340,57267292000140,ARTYODONTO BRASIL  PLANO DE ASSISTÊNCIA ODONTOLÓGICA LTDA,ativo
417769,12080518000161,ASSISTE ADMINISTRADORA DE BENEFÍCIOS LTDA,ativo
423912,53249803000140,ASSISTÊNCIA MÉDICA 12 DE OUTUBRO LTDA,ativo
325236,66854779000110,ASSISTÊNCIA MÉDICA SÃO MIGUEL LTDA,ativo
365297,1872588000136,ASSISTÊNCIA ODONTOLÓGICA ESPECIALIZADA LTDA,ativo
423432,47325263000134,"ASSOC DE ASSIST À SAÚDE DOS SERV DAS UNIV E INST FED, EST E/OU FAC PART EM PE",ativo
409634,73565319000138,ASSOCIACAO CIVIL PRÓ-SAÚDE DOS SERVIDORES DA UNIVERSIDADE ESTADUAL DE PONTA GROSSA,ativo
360783,59007799000190,ASSOCIACAO DE SAUDE HOLAMBRA,ativo
317632,62635990000191,ASSOCIACAO DOS AUDITORES FISCAIS DA RECEITA ESTADUAL DE SAO PAULO,ativo
343129,13100755000100,ASSOCIACAO DOS PROFESSORES UNIVERSITÁRIOS DA BAHIA,ativo
420093,13083167000105,ASSOCIACAO DOS SERVIDORES DA EMDAGRO - ASSEM,ativo
406635,71565659000133,ASSOCIACAO POLICIAL DE ASSISTENCIA A SAUDE DE ITAPETININGA,ativo
410608,200720000109,ASSOCIACAO POLICIAL DE ASSISTENCIA A SAUDE DE PRESIDENTE PRUDENTE (APAS),ativo
417599,92741016000173,ASSOCIAÇAO DOS FUNCIONARIOS PUBLICOS DO ESTADO DO RIO GRANDE DO SUL,ativo
333867,89761670000134,ASSOCIAÇAO UNISAUDE MARAU,ativo
406554,83367342000171,ASSOCIAÇÃO ADVENTISTA NORTE BRASILEIRA DE PREVENÇÃO E ASSISTÊNCIA A SAÚDE,ativo
411752,3849449000117,ASSOCIAÇÃO ASSISTENCIAL DE SAÚDE SUPLEMENTAR CRUZ AZUL SAÚDE,ativo
322326,25335803000128,ASSOCIAÇÃO BENEFICENTE CATÓLICA,ativo
304131,2030246000131,ASSOCIAÇÃO BENEFICENTE DE ASSISTÊNCIA A SAÚDE DOS JUÍZES DO TRABALHO DA 15ª REGIÃO (ABAS 15),ativo
382540,31240963000196,ASSOCIAÇÃO BENEFICENTE DOS PROFESSORES PÚBLICOS ATIVOS E INATIVOS DO RIO DE JANEIRO - APPAI,ativo
417947,10935483000170,ASSOCIAÇÃO DA SANTA CASA SAÚDE DE RIBEIRÃO PRETO,ativo
417955,7945024000162,ASSOCIAÇÃO DE ASSISTÊNCIA MÉDICO HOSPITALAR DOS MAGISTRADOS DO ESTADO DO PARANÁ,ativo
416690,7781345000179,ASSOCIAÇÃO DE ASSISTÊNCIA À SAÚDE DA AMAGIS,ativo
416568,8202035000115,ASSOCIAÇÃO DE ASSISTÊNCIA À SAÚDE DOS EMPREGADOS DA COPASA,ativo
314218,60975174000100,ASSOCIAÇÃO DE BENEFICÊNCIA E FILANTROPIA SÃO CRISTOVÃO,ativo
422321,35657268000185,ASSOCIAÇÃO DE SAÚDE DO VALE,ativo
418731,15022430000181,ASSOCIAÇÃO DE SAÚDE DOS FORNECEDORES DE CANA DE PIRACICABA E REGIÃO,ativo
417530,11939445000158,ASSOCIAÇÃO DE SAÚDE PORTUGUESA DE BENEFICÊNCIA,ativo
393533,12317012000123,ASSOCIAÇÃO DO FISCO DE ALAGOAS,ativo
420000,15713057000105,ASSOCIAÇÃO DO PLANO DE SAÚDE DA SANTA CASA DE MISERICÓRDIA DE ITABUNA - PLANSUL,ativo
387185,34011288000111,ASSOCIAÇÃO DOS AUDITORES FISCAIS DA RECEITA ESTADUAL DO RIO DE JANEIRO,ativo
330281,9306242000182,ASSOCIAÇÃO DOS AUDITORES FISCAIS DO ESTADO DA PARAÍBA - AFRAFEP,ativo
384704,13170410000122,ASSOCIAÇÃO DOS EMPREGADOS DA COMPANHIA ESTADUAL DE HABITAÇÃO E OBRAS PÚBLICAS - ASSEC,ativo
382639,92911056000116,ASSOCIAÇÃO DOS FISCAIS DE TRIBUTOS ESTADUAIS DO RS - AFISVEC,ativo
306754,299149000113,ASSOCIAÇÃO DOS FUNCIONÁRIOS DO FISCO DO ESTADO DE GOIÁS,ativo
388092,4503249000170,ASSOCIAÇÃO DOS FUNCIONÁRIOS FISCAIS DO ESTADO DO AMAZONAS - AFFEAM,ativo
335754,14799035000147,ASSOCIAÇÃO DOS SERVIDORES FISCAIS DO ESTADO DA BAHIA,ativo
309028,29167970000168,"ASSOCIAÇÃO DOS SERVIDORES MUNICIPAIS, ESTADUAIS E FEDERAIS DO RIO DE JANEIRO",ativo
419591,20160828000114,ASSOCIAÇÃO DOS SERVIDORES PÚBLICOS DA ADMINISTRAÇÃO DIRETA DO GOVERNO DO ESTADO DO PARÁ - ASPARÁ,ativo
342556,87547444000120,ASSOCIAÇÃO DR. BARTHOLOMEU TACCHINI,ativo
326755,78613841000161,ASSOCIAÇÃO EVANGELICA BENEFICENTE DE LONDRINA,ativo
422053,33922160000147,ASSOCIAÇÃO FCA SAÚDE,ativo
416584,8883265000197,ASSOCIAÇÃO FUNDO DE PROTEÇÃO À SAÚDE,ativo
402206,2220135000198,ASSOCIAÇÃO GOIANA DO MINISTÉRIO PÚBLICO,ativo
421618,30724638000136,ASSOCIAÇÃO HOSPITAL SAÚDE DE VARGEM GRANDE DO SUL,ativo
423807,92685833000151,ASSOCIAÇÃO HOSPITALAR MOINHOS DE VENTO,ativo
419150,15323270000100,ASSOCIAÇÃO MAIS SAÚDE SANTA CASA DE SÃO JOÃO DA BOA VISTA,ativo
417211,11177786000133,ASSOCIAÇÃO MINEIRA DE ASSISTÊNCIA À SAÚDE DOS MEMBROS DO MINISTÉRIO PÚBLICO,ativo
420158,23869306000184,ASSOCIAÇÃO PADRE ALBINO SAÚDE,ativo
420816,25141173000150,ASSOCIAÇÃO PADRE PIO PLANOS DE SAÚDE,ativo
418617,12049486000131,ASSOCIAÇÃO PARANAENSE DE ASSISTÊNCIA À SAUDE DOS MEMBROS DO MINISTERIO PUBLICO DO PARANÁ,ativo
422631,39427632000171,ASSOCIAÇÃO PETROBRAS DE SAÚDE - APS,ativo
419958,20961779000119,ASSOCIAÇÃO PLANO DE SAÚDE SANTA CASA DE VALINHOS,ativo
408093,66493339000185,ASSOCIAÇÃO POLICIAL DE ASSISTENCIA A SAUDE DE BOTUCATU,ativo
408263,71753297000104,ASSOCIAÇÃO POLICIAL DE ASSISTENCIA À SAUDE DE SAO JOAO DA BOA VISTA,ativo
409413,444803000135,ASSOCIAÇÃO POLICIAL DE ASSISTÊNCIA A SAÚDE,ativo
410110,34259000153,ASSOCIAÇÃO POLICIAL DE ASSISTÊNCIA A SAÚDE DA BAIXADA SANTISTA,ativo
406813,59766105000107,ASSOCIAÇÃO POLICIAL DE ASSISTÊNCIA À SAÚDE,ativo
406937,57272510000135,ASSOCIAÇÃO POLICIAL DE ASSISTÊNCIA À SAÚDE,ativo
410128,71559272000174,ASSOCIAÇÃO POLICIAL DE ASSISTÊNCIA À SAÚDE,ativo
409405,642842000147,ASSOCIAÇÃO POLICIAL DE ASSISTÊNCIA À SAÚDE - VALE DO RIBEIRA,ativo
423203,841848000143,ASSOCIAÇÃO POLICIAL DE ASSISTÊNCIA À SAÚDE APAS,ativo
414212,59762062000183,ASSOCIAÇÃO POLICIAL DE ASSISTÊNCIA À SAÚDE DE ARAÇATUBA (APAS),ativo
407569,72916364000127,ASSOCIAÇÃO POLICIAL DE ASSISTÊNCIA À SAÚDE DE BARRETOS,ativo
406945,147571000153,ASSOCIAÇÃO POLICIAL DE ASSISTÊNCIA À SAÚDE DE BAURU,ativo
408026,665690000106,ASSOCIAÇÃO POLICIAL DE ASSISTÊNCIA À SAÚDE DE DRACENA,ativo
408034,66491036000123,ASSOCIAÇÃO POLICIAL DE ASSISTÊNCIA À SAÚDE DE JAÚ,ativo
411248,648506000101,ASSOCIAÇÃO POLICIAL DE ASSISTÊNCIA À SAÚDE DE PRESIDENTE VENCESLAU,ativo
408794,72918287000144,ASSOCIAÇÃO POLICIAL DE ASSISTÊNCIA À SAÚDE DE RIBEIRÃO PRETO (APAS),ativo
420786,24807514000111,ASSOCIAÇÃO SANTA CASA CLÍNICAS DE BIRIGUI,ativo
418803,16665579000141,ASSOCIAÇÃO SANTA CASA SAÚDE DE ARAÇATUBA,ativo
419249,18321477000134,ASSOCIAÇÃO SANTA CASA SAÚDE DE SÃO JOSÉ DOS CAMPOS,ativo
418021,13001218000102,ASSOCIAÇÃO SANTA SAÚDE,ativo
330892,2903477000102,ASSOCIAÇÃO SAÚDE CONCEIÇÃO,ativo
418218,11336728000105,ASSOCIAÇÃO SAÚDE RURAL ALEGRETE,ativo
418919,11867361000156,ASSOCIAÇÃO SAÚDE SÃO JOSÉ,ativo
417220,10796140000171,ASSOCIAÇÃO SERVIÇOS ODONTOLÓGICOS DA INDÚSTRIA DE MINAS GERAIS - ODONTOINDUSTRIA,ativo
419141,14946109000120,ASSOCIAÇÃO SÃO FRANCISCO VIDA,ativo
421006,27067508000163,ASSOCIAÇÃO SÃO LUIZ SAÚDE,ativo
420123,23557177000199,ASSOCIAÇÃO UNIVIDA SANTA RITA DO PASSA QUATRO,ativo
412635,307714000147,ASSOCIAÇÃO VALEPARAIBANA DE ASSISTÊNCIA MÉDICA POLICIAL,ativo
420794,23779545000143,ASSOREL BRASIL ADMINISTRADORA DE BENEFICIOS LTDA - EPP,ativo
336874,15245079000198,ATEMDE ODONTO SAÚDE CLUBE DE BENEFÍCIOS,ativo
424528,59641573000147,ATIMED ASSISTENCIA MEDICA LTDA,ativo
422151,34732056000152,ATITUDE SAÚDE ASSISTÊNCIA MEDICA LTDA,ativo
424714,62383533000157,ATIVUS LIFE ADMINISTRADORA DE BENEFICIOS LTDA,ativo
320510,69289171000189,ATÍVIA SERVIÇOS DE SAÚDE S/A,ativo
423629,49955478000164,AURORA SAÚDE LTDA,ativo
327417,59847780000152,AUSTACLINICAS ASSISTÊNCIA MÉDICA E HOSPITALAR LTDA,ativo
423734,50507787000150,AVANT ADMINISTRADORA DE BENEFICIOS LTDA,ativo
424005,51124739000146,AVANTI ADMINISTRADORA DE BENEFÍCIOS EM SAÚDE LTDA EPP,ativo
418013,12903235000172,BACCS ADMINISTRADORA DE BENEFÍCIOS LTDA,ativo
422991,41215349000128,BAUEN LIFE LTDA.,ativo
419257,19240452000179,BCI ADMINISTRADORA DE BENEFÍCIOS LTDA.,ativo
419125,7611953000135,BEDOIS SERVIÇOS DE ADMINISTRAÇÃO DE BENEFÍCIOS LTDA.,ativo
421332,29138326000161,BEM ADMINISTRADORAS LTDA,ativo
420697,25313773000159,BEM ESTAR ADMINISTRADORA DE BENEFÍCIOS LTDA,ativo
417874,8192597000125,BEM MAIS ODONTO OPERADORA ODONTOLÓGICA LTDA.,ativo
423181,45050963000138,BEMSTAR ASSISTENCIA MEDICA LTDA,ativo
318299,83506030000100,BENEFICENCIA CAMILIANA DO SUL,ativo
421189,22709109000135,BENEFICENCIA SOCIAL BOM SAMARITANO,ativo
419869,12380335000161,BENEFIT ADMINISTRADORA DE BENEFÍCIOS LTDA.,ativo
423891,50436148000141,BENEFIT BENEFICIOS LTDA,ativo
423467,46092428000102,BENET ADMINISTRAÇÃO DE BENEFÍCIOS LTDA,ativo
421324,29179109000110,BENEVITAE ADMINISTRADORA DE BENEFÍCIOS LTDA,ativo
417718,11073058000181,BENEVIX ADMINISTRADORA DE BENEFÍCIOS LTDA,ativo
366561,2849393000138,BENSAUDE PLANO DE ASSISTENCIA MEDICA HOSPITALAR LTDA.,ativo
420042,13852392000169,BEST LIFE ASSESSORIA NA GESTÃO E ADMINISTRADORA DE BENEFÍCIOS LTDA,ativo
421766,32421708000102,BEST SENIOR OPERADORA DE SAÚDE LTDA,ativo
402966,3123146000112,BIO SAÚDE SERVIÇOS MÉDICOS LTDA,ativo
419079,14674151000130,BIORAL SISTEMA ODONTOLÓGICO LTDA.,ativo
415111,4299138000194,BIOVIDA SAÚDE LTDA.,ativo
422401,34673588000166,BIT LIFE BENEFÍCIOS LTDA,ativo
424552,60233601000176,BKR SAÚDE ADMINISTRADORA DE BENEFÍCIOS LTDA,ativo
424170,54557861000102,BLUZZ SAÚDE S/A,ativo
424218,56980711000124,BOA SAUDE ADMNISTRADORA DE BENEFICIOS DE SAUDE LTDA,ativo
424706,62090465000138,BONNA SAUDE LTDA,ativo
421715,15011651000154,BRADESCO SAÚDE - OPERADORA DE PLANOS  S/A,ativo
5711,92693118000160,BRADESCO SAÚDE S.A.,ativo
421561,31596055000130,BRASIL ODONTO OPERADORA DE PLANOS ODONTOLÓGICOS LTDA,ativo
419419,19962272000109,BRASILDENTAL OPERADORA DE PLANOS ODONTOLÓGICOS S.A.,ativo
419613,14838567000146,BRAZIL DENTAL OPERADORA DE PLANOS ODONTOLÓGICOS LTDA,ativo
417238,1838723000127,BRF S/A,ativo
424536,58246775000121,BRS ADMINISTRADORA DE SAUDE LTDA,ativo
423530,46293680000180,BWG ADMINISTRADORA DE BENEFICIOS LTDA.,ativo
415774,7844436000106,CABERJ INTEGRAL SAÚDE S.A,ativo
424021,50805425000146,CACSS ADMINISTRADORA DE BENEFICIOS LTDA,ativo
327557,83937631000169,CAIXA ASSISTENCIAL E BENEFICENTE DOS FUNCIONÁRIOS DA ACARESC,ativo
347825,1052203000194,CAIXA ASSISTENCIAL UNIVERSITARIA DO RIO DE JANEIRO,ativo
314251,2172353000102,CAIXA ASSISTENCIAL UNIVERSITÁRIA DO RIO GRANDE DO NORTE,ativo
352331,62231527000184,CAIXA BENEFICENTE DOS FUNCIONARIOS DO BANCO DO ESTADO DE SÃO PAULO,ativo
414026,78304672000188,CAIXA BENEFICENTE DOS FUNCIONÁRIOS DO GRUPO IGUAÇU,ativo
316873,73395469000140,CAIXA DE ASSISTENCIA A SAUDE DA UNIVERSIDADE,ativo
413534,4311093000126,CAIXA DE ASSISTENCIA DOS SERVIDORES DO ESTADO DE MATO GROSSO DO SUL,ativo
418820,27085968000114,CAIXA DE ASSISTÊNCIA AOS MEMBROS DA DEFENSORIA PÚBLICA DO ESTADO DO RIO DE JANEIRO,ativo
413518,4197511000104,CAIXA DE ASSISTÊNCIA DO SINDFISCO - CASSIND,ativo
416401,8097092000181,CAIXA DE ASSISTÊNCIA DOS EMPREGADOS DA EMPRESA BRASILEIRA DE PESQUISA  AGROPECUÁRIA,ativo
363855,37382009000114,CAIXA DE ASSISTÊNCIA DOS EMPREGADOS DA SANEAGO,ativo
307319,2315431000172,CAIXA DE ASSISTÊNCIA DOS EMPREGADOS DO BANCO DO ESTADO DO RIO GRANDE DO SUL,ativo
315583,15215452000168,CAIXA DE ASSISTÊNCIA DOS EMPREGADOS DO BANEB,ativo
335789,13086566000120,CAIXA DE ASSISTÊNCIA DOS EMPREGADOS DO BANESE,ativo
344184,33601568000117,CAIXA DE ASSISTÊNCIA DOS EMPREGADOS DO SETOR PÚBLICO DO ESTADO DE GOIÁS - CAEME,ativo
343331,28502128000172,CAIXA DE ASSISTÊNCIA DOS EMPREGADOS DO SISTEMA FINANCEIRO BANESTES,ativo
358754,4204285000133,CAIXA DE ASSISTÊNCIA DOS FUNCIONÁRIOS DO BANCO DA AMAZÔNIA - CASF,ativo
346659,33719485000127,CAIXA DE ASSISTÊNCIA DOS FUNCIONÁRIOS DO BANCO DO BRASIL,ativo
385697,5814777000103,CAIXA DE ASSISTÊNCIA DOS FUNCIONÁRIOS DO BANCO DO NORDESTE DO BRASIL,ativo
302627,35617257000171,CAIXA DE ASSISTÊNCIA DOS MAGISTRADOS DE PERNAMBUCO,ativo
359122,63367700000139,CAIXA DE ASSISTÊNCIA DOS SERVIDORES FAZENDÁRIOS ESTADUAIS,ativo
417548,3033006000153,CAIXA DE ASSISTÊNCIA OSWALDO CRUZ,ativo
320820,668790000188,CAIXA DE ASSISTÊNCIA SISTEMA SAÚDE INTEGRAL-SSI SAUDE,ativo
412295,3702977000149,CAIXA DE ASSISTÊNCIA À SAUDE DOS EMPREGADOS DA CODEVASF - CASEC,ativo
324361,42182170000184,CAIXA DE ASSISTÊNCIA À SAÚDE - CABERJ,ativo
417661,11996146000155,CAIXA DE ASSISTÊNCIA À SAÚDE DO SINDICATO DOS FUNCIONÁRIOS INTEGRANTES DO GRUPO OCUPACIONAL ADMINISTRAÇÃO TRIBUTÁRIA DO ESTADO DE PERNAMBUCO,ativo
421341,4574626000162,CAIXA DE ASSISTÊNCIA À SAÚDE DOS SERVIDORES PÚBLICOS DO ESTADO DO MATO GROSSO DO SUL,ativo
419851,21205801000163,"CAIXA DE ASSISTÊNCIA À SAÚDE DOS TRABALHADORES NAS INDÚSTRIAS METALÚRGICAS, MECÂNICAS E DO MATERIAL ELÉTRICO DE BRUSQUE",ativo
324477,30036685000197,CAIXA DE PREVIDÊNCIA E ASSISTÊNCIA DOS SERVIDORES DA FUNDAÇÃO NACIONAL DE SAÚDE - CAPESESP,ativo
312924,360305000104,CAIXA ECONÔMICA FEDERAL,ativo
418072,13223975000120,CAIXA SEGURADORA ESPECIALIZADA EM SAÚDE S/A,ativo
319872,35908607000159,CAMIM OPERADORA DE PLANO DE SAÚDE LTDA,ativo
417785,4566215000125,CAMPEÃ ADMINISTRADORA DE BENEFÍCIOS LTDA.,ativo
419265,17634722000109,CAPITAL ADMINISTRADORA DE BENEFÍCIOS LTDA.,ativo
379956,2725347000127,CARE PLUS MEDICINA ASSISTENCIAL LTDA.,ativo
389358,856424000152,CARE PLUS ODONTOLOGIA ASSISTENCIAL LTDA.,ativo
422304,36263502000152,CARING SAÚDE ASSISTÊNCIA MÉDICA LTDA.,ativo
327328,5455431000166,CASA DE SAÚDE NOSSA SENHORA DE FÁTIMA  LTDA.,ativo
417165,9114713000150,CASE - CENTRAL DE ADMINISTRAÇÃO DE PLANO DE SAÚDE LTDA,ativo
423637,49884840000153,CASUFES SAÚDE ADMINISTRADORA DE BENEFÍCIOS,ativo
415952,64170517000101,CDA - ASSISTÊNCIA ODONTOLÓGICA LTDA - EPP,ativo
311472,18987107000130,CEAM BRASIL - PLANOS DE SAÚDE LTDA,ativo
418749,6814351000112,CEDPLAN SAÚDE LTDA EPP,ativo
339270,42278796000199,CELULOSE NIPO-BRASILEIRA S/A - CENIBRA,ativo
417505,12055813000168,CEMIG SAÚDE,ativo
422436,4940191000122,CENIBRA LOGÍSTICA LTDA,ativo
417092,10540020000109,CENTRAL OPERADORA DE PLANOS DE SAÚDE NORTE-NORDESTE LTDA,ativo
386596,366982000130,CENTRAL REGIONAL DAS COOPERATIVAS MÉDICAS - UNIMED CERRADO,ativo
392804,773639000100,CENTRO CLÍNICO GAÚCHO LTDA,ativo
415910,2569472000195,CENTRO DE ENDOCRINOLOGIA DE JUNDIAÍ S/S LTDA,ativo
350699,950062000164,CENTRO HOSPITALAR ATIBAIA LTDA.,ativo
314757,37161015000141,CENTRO ODONTOLOGICO INTEGRADO LTDA,ativo
303623,62638374000194,CENTRO TRASMONTANO DE SAO PAULO,ativo
401871,64928609000108,CEORP - CENTRO ODONTOLOGICO LTDA,ativo
324892,43776491000170,CETESB - COMPANHIA AMBIENTAL DO ESTADO DE SÃO PAULO,ativo
310247,88645403000139,CIRCULO OPERARIO CAXIENSE,ativo
423963,40432544000147,CLARO S.A,ativo
419435,20088388000131,CLASSE ADMINISTRADORA DE BENEFÍCIOS LTDA - ME,ativo
423327,43383373000100,CLICSAUDE ADMINISTRADORA DE BENEFICIOS LTDA,ativo
410071,3447952000146,CLINICA ODONTOLOGICA ODONTOPLAN LTDA,ativo
340782,76882612000117,CLINIPAM CLINICA PARANAENSE DE ASSISTENCIA MEDICA LTDA,ativo
417891,9585273000110,"CLUBE DE BENEFICIOS PARA COOP., ASS., CONS., SIND. E SEGUROS - CBCACSS",ativo
422461,38046343000160,CLUBE SILVER ADMINISTRADORA DE PLANOS DE SAUDE LTDA,ativo
415944,51262335000119,CLÍNICA SÃO GABRIEL S/S LTDA,ativo
419796,14372148000161,COMPANHIA DAS DOCAS DO ESTADO DA BAHIA - CODEBA,ativo
330051,47902648000117,COMPANHIA DE ENGENHARIA DE TRAFEGO - CET,ativo
416509,27316538000166,COMPANHIA DOCAS DO ESPIRITO SANTO - CODESA,ativo
392405,28151363000147,COMPANHIA ESPIRITO SANTENSE DE SANEAMENTO,ativo
334189,26461699000180,COMPANHIA NACIONAL DE ABASTECIMENTO - CONAB,ativo
420247,23920704000188,COMPAR ADMINISTRADORA DE BENEFICIOS LTDA - ME,ativo
390259,70094578000130,COMSEDER - COOPERATIVA DE ASSISTÊNCIA MÉDICA DOS SERVIDORES DA SUPLAN E DO DER LTDA,ativo
424579,60662550000106,CONECTA ADMINISTRADORA DE BENEFICIOS LTDA,ativo
423220,45400278000194,CONECTAPLAN ADMINISTRADORA DE BENEFÍCIOS LTDA,ativo
321931,29640612000120,CONFERÊNCIA SÃO JOSÉ DO AVAÍ,ativo
410624,3613857000175,CONFIANÇA ASSISTÊNCIA MÉDICO HOSPITALAR LTDA,ativo
405931,60537495000114,CONSTRUDENTE ASSISTENCIA ODONTOLOGICA LTDA,ativo
418323,13286268000183,CONTEM ADMINISTRADORA DE PLANOS DE SAÚDE LTDA.,ativo
407241,2298249000150,COOP-ODONTOCLASSIC - COOPERATIVA DE TRABALHO ODONTOLÓGICO,ativo
367087,87158507000156,COOPERATIVA CENTRAL UNIMED DE COOPERATIVAS DE ASSISTÊNCIA À SAÚDE DO RIO GRANDE DO SUL LTDA.,ativo
353477,1041724000146,COOPERATIVA DE ASSISTÊNCIA ODONTOLÓGICA VALE DO CAÍ LTDA - DENTSUL,ativo
418242,1750093000134,COOPERATIVA DE SAÚDE ODONTOLÓGICA - UNIODONTO RORAIMA,ativo
313084,25064148000110,COOPERATIVA DE TRABALHO MEDICO DE ARAGUAÍNA - UNIMED ARAGUAÍNA,ativo
318213,85246916000189,COOPERATIVA DE TRABALHO MEDICO REGIÃO DO PLANALTO SERRANO,ativo
337188,21490586000190,COOPERATIVA DE TRABALHO MÉDICO DE POUSO ALEGRE,ativo
317012,85177194000158,COOPERATIVA DE TRABALHO MÉDICO DO PLANALTO NORTE DE SANTA CATARINA LTDA,ativo
419028,25906728000108,COOPERATIVA DE TRABALHO ODONTOLOGICO - UNIODONTO ITAJUBÁ,ativo
359459,2725037000102,COOPERATIVA DOS CIRURGIÕES DENTISTAS DO ESTADO DE SERGIPE,ativo
404241,72350382000194,COOPERATIVA DOS USUÁRIOS DE SERVIÇOS DE SAÚDE DO VALE DO RIO DOS SINOS LTDA,ativo
406805,3268622000193,COOPERATIVA DOS USUÁRIOS DE SERVIÇOS DE SAÚDE LTDA.,ativo
400572,2947180000149,COOPERATIVA EVIDENTE - COOPERATIVA DE TRABALHO ODONTOLÓGICA DE BOTUCATU,ativo
342335,1501597000110,COOPERATIVA ODONTOLÓGICA DE GARANHUNS E AGRESTE MERIDIONAL.,ativo
365785,2254846000183,COOPERATIVA ODONTOLÓGICA DO ESTADO DO AMAPÁ,ativo
409791,3494031000134,COOPERATIVA ODONTOLÓGICA POÇOS DE CALDAS,ativo
402010,491998000174,COOPERATIVA ODONTOLÓGICA REGIÃO SUL DA BAHIA - UNIODONTO,ativo
353892,19052653000142,COOPERCISO - CENTRO INTEGRADO DE SERVIÇO ODONTOLÓGICO S/S LTDA.,ativo
418757,73505463000189,CORPLIFE ADMINISTRADORA DE BENEFÍCIOS LTDA ,ativo
418960,17670901000193,CORPORE ADMINISTRADORA DE BENEFICIOS DA SAUDE LTDA,ativo
368181,19009638000111,CROE - CENTRO DE REABILITACAO ORAL ESPECIALIZADO LTDA,ativo
397245,69099307000198,CROWN ODONTOLOGIA DE GRUPO LTDA,ativo
421952,33803129000197,CRZ PLANO ODONTOLÓGICO LTDA,ativo
422045,34824393000170,CTESK ADMINISTRADORA DE BENEFIÍCIOS LTDA,ativo
424242,56298884000167,CUIDE SAÚDE ADMINISTRADORA DE BENEFÍCIOS LTDA.,ativo
416118,253137000158,DANA INDUSTRIAS LTDA.,ativo
421081,27832058000158,DELFHI PLANOS ODONTOLÓGICOS LTDA,ativo
420239,24619902000179,DENTAL CARE ASSISTÊNCIA ODONTOLÓGICA LTDA,ativo
386219,66493529000100,DENTAL CARE CLINICA ODONTOLOGICA LTDA,ativo
339458,35436658000125,DENTAL CENTER LTDA,ativo
300730,1402285000150,DENTAL GOLD ASSISTÊNCIA ODONTOLÓGICA LTDA.,ativo
424676,58739669000180,DENTAL KLIN ASSISTENCIA ODONTOLOGICA LTDA,ativo
413747,4212174000179,DENTAL MASTER LTDA - EPP,ativo
314366,571628000147,DENTAL PLUS CONVÊNIO ODONTOLÓGICO LTDA.,ativo
424447,20735214000113,DENTAL SAUDE SUPREME PLANOS ODONTOLOGICOS LTDA,ativo
304484,78738101000151,DENTAL UNI - COOPERATIVA ODONTOLÓGICA,ativo
423050,43192903000124,DENTAL WHITE PLANO DE ASSISTÊNCIA ODONTOLÓGICA LTDA,ativo
333620,73193000100,DENTAL-MED ASSISTENCIA ODONTOLOGICA S/S LTDA,ativo
401463,1364933000120,DENTALMASTER COMÉRCIO DE PLANOS ODONTOLÓGICOS LTDA,ativo
422975,39527909000138,DENTALMASTER LTDA,ativo
322890,2156150000114,DENTALPAR ASSISTÊNCIA ODONTOLÓGICA EMPRESARIAL LTDA.,ativo
416908,5616674000139,DENTALPLAN PLANOS DE ASSISTENCIA ODONTOLOGICA LTDA,ativo
327867,1060301000173,DENTIÇÃO CONVÊNIOS ODONTOLÓGICOS LTDA,ativo
414425,3113408000168,DENTSY ODONTOLOGIA S/S LTDA.,ativo
357669,19969500000164,DESBAN - FUNDAÇÃO BDMG DE SEGURIDADE SOCIAL,ativo
423271,45768601000187,DIXMED ADMINISTRADORA DE BENEFICIOS LTDA ,ativo
349682,1387625000110,DOCTOR CLIN OPERADORA DE PLANOS DE SAÚDE LTDA.,ativo
365645,30505523000150,DONA SAÚDE CLINICAS LTDA ,ativo
423653,47058412000146,DR DIA PLANOS ODONTOLOGICOS E SAUDE LTDA,ativo
416282,7893499000152,E.X.M BRASIL SAÚDE LTDA,ativo
418927,17312105000189,EASY SAUDE ADMINISTRADORA DE BENEFICIOS LTDA,ativo
421120,27252086000104,EASYPLAN ADMINISTRADORA DE BENEFICIOS LTDA.,ativo
342611,49320799000192,ECONOMUS INSTITUTO DE SEGURIDADE SOCIAL,ativo
417343,39245402000191,ECS ADMINISTRADORA DE BENEFICIOS LTDA,ativo
423521,48578525000135,EGRÉGORA  ADMINISTRADORA DE BENEFICIOS S/A,ativo
422070,34844263000107,ELETROS SAÚDE - ASSOCIAÇÃO DE ASSISTÊNCIA À SAÚDE,ativo
424544,58434577000191,ELITE SAUDE SERVICOS MEDICOS LTDA.,ativo
417297,11593821000103,ELOSAÚDE - ASSOCIAÇÃO DE ASSISTÊNCIA À SAÚDE,ativo
400891,352294000110,EMPRESA BRASILEIRA DE INFRA-ESTRUTURA AEROPORTUÁRIA,ativo
395480,37135365000133,ESMALE ASSISTENCIA INTERNACIONAL DE SAUDE LTDA.,ativo
424625,60967570000187,ESPERANÇA OPERADORA DE PLANOS DE SAÚDE LTDA,ativo
422576,37442364000131,ESPLENDOR ADMINISTRADORA DE BENEFÍCIOS LTDA.,ativo
417441,1856107000107,EV ADMINISTRADORA DE BENEFÍCIOS LTDA,ativo
401480,2989632000155,EVANGELICO SAUDE LTDA.,ativo
423700,49754083000101,EVO SAUDE ASSISTENCIA MEDICA LTDA,ativo
423785,51107481000170,EVOLUÇÃO ADMINISTRADORA DE BENEFICIOS LTDA ,ativo
421642,31763326000102,EXCELÊNCIA PLANO DE SAÚDE S/A,ativo
424471,58363709000131,EXCLUSIVO ODONTO ASSISTENCIA ODONTOLOGICA LTDA,ativo
414204,1747987000175,EXTRAMED ADMINISTRAÇÃO E SERVIÇOS MÉDICOS LTDA,ativo
423777,11641931000195,FEBRAFITE SAUDE,ativo
423581,49390919000128,FEDERAL ADMINISTRADORA DE BENEFICIOS LTDA,ativo
415626,7270625000112,FEDERAÇÃO DAS COOP ODONTOLÓGICAS DO ESTADO DE SANTA CATARINA,ativo
313971,84112481000117,"FEDERAÇÃO DAS SOCIEDADES COOPERATIVAS DE TRABALHO MÉDICO DO ACRE, AMAPÁ, AMAZONAS, PARÁ, RONDONIA E RORAIMA",ativo
410888,3637776000105,FILOSANITAS SAUDE LTDA,ativo
421847,33105631000124,FOCO ADMINISTRADORA DE BENEFICIOS LTDA,ativo
423921,52174905000181,FOX SAÚDE ASSISTÊNCIA MÉDICA INTEGRADA LTDA,ativo
419818,9030500000140,FR PLANO ODONTOLÓGICO LTDA,ativo
370592,2618303000106,FUNASA SAÚDE,ativo
329665,580481000151,FUNDACAO CAPITAL PREVIDENCIA E SAUDE - CAPITAL PREV,ativo
410292,60499365000134,FUNDACAO LEONOR DE BARROS CAMARGO,ativo
307751,12585261000108,FUNDAÇAO COMPESA DE PREVIDENCIA E ASSISTENCIA - COMPESAPREV,ativo
315567,660903000107,FUNDAÇÃO AFFEMG DE ASSISTÊNCIA E SAÚDE - FUNDAFFEMG,ativo
346926,628107000189,FUNDAÇÃO ASSISTENCIAL DOS SERVIDORES DO MINISTÉRIO DA FAZENDA,ativo
315044,82956996000178,FUNDAÇÃO CELESC DE SEGURIDADE SOCIAL - CELOS,ativo
315478,62465117000106,FUNDAÇÃO CESP,ativo
317233,42160192000143,FUNDAÇÃO CHESF DE ASSISTÊNCIA E SEGURIDADE SOCIAL,ativo
355151,75054940000162,FUNDAÇÃO COPEL DE PREVIDÊNCIA E ASSISTÊNCIA SOCIAL,ativo
339636,397695000197,FUNDAÇÃO DE ASSISTÊNCIA E PREVIDÊNCIA SOCIAL DO BNDES,ativo
420701,25063964000100,FUNDAÇÃO DE ASSISTÊNCIA À SAÚDE DA ASSOCIAÇÃO DO MINISTÉRIO PÚBLICO DO RIO GRANDE DO SUL,ativo
