registro_ans,cnpj,razao_social,status
331309,86960929000188,MASSA FALIDA DE VITAMED - ASSISTÊNCIA MÉDICA E ODONTOLÓGICA LTDA.,cancelado
412791,4171205000190,MASSA FALIDA DE VIVA PLANOS DE SAÚDE LTDA,cancelado
417254,11182842000128,MASSA FALIDA DE VIVERMAIS ASSISTÊNCIA MÉDICA LTDA.,cancelado
358126,1778871000101,MASSA FALIDA DE ÔMEGA  SAÚDE - OPERADORA DE PLANOS DE SAÚDE LTDA,cancelado
351113,28124782000190,MASSA FALIDA DENT-SERVICE ASSISTENCIA ODONTOLOGICA INTERNACIONAL LTDA,cancelado
404713,3178534000109,MASSA FALIDA ITAPEMIRIM  SAÚDE LTDA.,cancelado
360961,3227640000127,MASSA FALIDA LAM OPERADORA DE PLANOS DE SAUDE LTDA.,cancelado
407780,2758158000150,MASSA FALIDA LIFE SAUDE MEDICA LTDA,cancelado
412244,3749638000118,MASSA FALIDA MAYER SISTEMAS DE SAÚDE LTDA,cancelado
376604,643479000184,MASSA FALIDA OPEN SAÚDE LTDA,cancelado
416029,8088172000170,MASSA FALIDA PLANLIFE - ASSISTÊNCIA MÉDICA LIMITADA,cancelado
350559,92766641000170,MASSA FALIDA POLICLÍNICA CENTRAL LTDA.,cancelado
381161,719945000168,MASSA FALIDA REAL SAUDE LTDA EPP,cancelado
413089,4193880000110,MASSA FALIDA TENHA SAÚDE - OPERADORA DE PLANOS DE SAÚDE LTDA ,cancelado
336378,2363740000118,MASSA FALIDA UNIAO ADMINISTRADORA DE SAÚDE LTDA,cancelado
403334,1717086000130,MASSA FALIDA VIVER SIS-SISTEMA INTEGRADO DE SAÚDE LTDA.,cancelado
406538,2954861000134,MASTER CLÍNICA  S/C LTDA.,cancelado
415201,4879295000179,MASTER ODONTO ASSISTENCIA ODONTOLOGICA LTDA.,cancelado
370339,2114321000142,MASTER PLUS ASSISTENCIA ODONTOLOGICA LTDA.,cancelado
370967,2765267000103,MASTER SAUDE ASSISTENCIA MÉDICA ODONTOLOGICA,cancelado
332615,669832000103,MASTER SAÚDE ASSISTÊNCIA MÉDICA LTDA,cancelado
414077,4487764000104,MASTERMED ADM. DE PLANOS DE SAÚDE LTDA,cancelado
30248,71561013000188,MASTERMED CONVENIO MEDICO S/C LTDA.,cancelado
335801,26265322000156,MATERMED ASSISTÊNCIA MÉDICA - EIRELI,cancelado
414751,46043980000100,MATERNIDADE DE CAMPINAS,cancelado
37440,17272568000164,MATERNIDADE OCTAVIANO NEVES S/A,cancelado
406724,71562110000195,MATTER DENS ADM. DE SERVIÇOS ODONTOLOGICOS S/C LTDA,cancelado
352799,58935131000140,MAX MED ORGANIZAÇÕES DE MANUTENÇÃO DE SAUDE ASSOCIADAS S/A,cancelado
323233,2622829000151,MAX ODONTO DE ITAJUBÁ LTDA,cancelado
414697,5401529000130,MAXI CARE ODONTOLOGIA EMPRESARIAL S.A.,cancelado
411493,1708161000105,MAXIMUS ASSISTENCIA A SAUDE S/C LTDA,cancelado
317021,736859000163,MAXION COMPONENTES AUTOMOTIVOS S.A.,cancelado
389137,1930685000138,MAXION NACAM LTDA,cancelado
6050,96722707000180,MAXMED SEGURADORA S/A,cancelado
6084,87883807000106,MBM SEGURADORA S/A,cancelado
408344,3375265000162,MCA DO BRASIL S.A.,cancelado
407461,1272751000120,MCR CUNHA COMERCIALIZAÇÃO DE PLANOS MÉDICOS ME,cancelado
372072,61968970000170,MECA LTDA MEDICINA E CIRURGIA ASSISTENCIAL,cancelado
356298,1991178000104,MED CARD SAUDE LTDA,cancelado
415511,3079189000148,MED CONSULT LTDA.,cancelado
412198,2993879000145,MED FAMILY - O MÉDICO DA FAMILÍA S/C LTDA,cancelado
34374,86955473000168,MED HELP ASSISTENCIA MÉDICA ASSOCIADOS LTDA,cancelado
410390,2873491000100,MED LAB CONVENIOS S/C LTDA.,cancelado
421880,33605392000171,MED LIFE OPERADORA ODONTOLÓGICA LTDA,cancelado
419656,20966807000190,MED LIFE SAUDE ATA LTDA,cancelado
338249,1803324000120,MED NEW - PARTICIPAÇÕES S/S LTDA.,cancelado
347710,24443939000199,MED PLAN SERVIÇOS MÉDICOS LTDA,cancelado
356727,1891939000156,MED PLUS ASSESSORIA E ASSISTENCIA S/C LTDA,cancelado
34026,2155017000143,MED PROG - MEDICINA PROGRAMADA LTDA,cancelado
31325,2367889000175,MED SAUDE - SISTEMAS MÉDICOS DE CURITIBA S/C LTDA,cancelado
416550,5948276000110,MED SAÚDE LTDA - ME,cancelado
402800,50734821000120,MED-CLÍNICA RIBEIRÃO PRETO LTDA.,cancelado
412422,3826258000130,MEDCENTER - CENTRO DE SERVIÇOS MEDICOS S/C LTDA,cancelado
420727,26286602000140,MEDCLASS ADMINISTRADORA DE BENEFÍCIOS,cancelado
421227,28786120000185,MEDCLASS BENEFÍCIOS EIRELI,cancelado
325881,343120000191,MEDCLIN - ADMINISTRAÇAO EM SAUDE S/C LTDA,cancelado
403172,78417375000149,MEDCLINICAS MÉDICA E ODONTOLÓGICA S/C LTDA.,cancelado
328201,48024822000139,MEDES CLINICA MÉDICA LTDA,cancelado
341207,83340927000106,MEDGRUPO ASSISTENCIA INTERNACIONAL DE SAUDE S/C LTDA,cancelado
327034,73513889000184,MEDIAL SAUDE RIO DE JANEIRO LTDA,cancelado
419532,13124700000130,MEDIATORE ADMINISTRAÇÃO DE BENEFÍCIOS LTDA,cancelado
337676,2147880000159,MEDIBRAS COMÉRCIO E SERVIÇOS EM SAÚDE LTDA,cancelado
360767,1370425000155,MEDICAL MEDICINA ASSISTENCIAL S/A,cancelado
422274,36500688000116,MEDICAL PLANOS DE SAÚDE S/A,cancelado
401528,1218317000161,MEDICAL PREV LTDA,cancelado
322946,46956918000100,MEDICAMP ASSISTÊNCIA MÉDICA LTDA,cancelado
382574,61163374000112,MEDICOL MEDICINA COLETIVA S/A,cancelado
406252,3193167000104,MEDICOR - ASSISTENCIA MÉDICA E ODONTOLÓGICA LTDA,cancelado
40207,43084037000158,MEDINTER - SOCIEDADE BRASILEIRA DE ASSISTÊNCIA MÉDICA S/C. LTDA.,cancelado
368849,49364193000159,MEDIPLAN ASSISTENCIAL LTDA,cancelado
349127,88116074000139,MEDISUL ASSISTÊNCIA MÉDICA EMPRESARIAL LTDA.,cancelado
400432,2783822000111,MEDLAR EMERGENCIAS MEDICAS LTDA,cancelado
413241,2080928000159,MEDLINE ASSISTENCIA MÉDICA LTDA,cancelado
371530,1248388000107,MEDMASTER ASSISTENCIA MEDICA S/C LTDA,cancelado
337510,1892976000189,MEDPLAN ASSISTÊNCIA MEDICA LTDA.,cancelado
417386,10850417000105,MEDPLAN PLANO DE SAÚDE LTDA,cancelado
352055,55346480000139,MEDPORTO ASSISTÊNCIA MÉDICA LTDA.,cancelado
372137,81761496000118,MEDTRAL MEDICINA E SEGURANÇA DO TRABALHO S/C LTDA,cancelado
329193,790302000100,MEDVALE - SOC. DE PREST. DE SERV. MÉDICOS JACIARA LTDA.,cancelado
349577,73953150000193,MEDVALE SAÚDE LTDA,cancelado
352454,20324000191,MEG LESTE HOSPITALAR S/A,cancelado
411035,3524582000101,MEGA SAÚDE - COOPERATIVA MÉDICA E DOS PROFISSIONAIS DE SAÚDE,cancelado
406970,3077324000116,MEGA SISTEMA DE SAÚDE S/C LTDA,cancelado
413844,73723181000158,MEKNES ADMINISTRAÇÃO EM SAUDE S/C LTDA,cancelado
346080,17577123000192,MEL CRIAÇOES LTDA,cancelado
373010,2902680000164,MEMORIAL CONSULT LTDA,cancelado
368768,17162082000173,MENDES JUNIOR ENGENHARIA S/A,cancelado
400335,22265482000144,MENDES MELO EMPREENDIMENTOS LTDA.,cancelado
376558,45987013000134,MERCK SHARP & DOHME FARMACEUTICA LTDA.,cancelado
404497,1567030000147,MERCOSUL SISTEMA DE ATENDIMENTO ODONTOLÓGICO S/C LTDA,cancelado
406520,3029890000152,MERIDIONAL ADMINISTRAÇÃO DE RECURSOS EM SAÚDE S/C LTDA,cancelado
411094,23009855000189,META - ASSESSORIA EM MEDICINA DO TRABALHO LTDA.,cancelado
300365,428553000140,METODONT - ASSISTÊNCIA ODONTOLOGICA LTDA,cancelado
409740,58969031000135,MGS CONSULTORIA E ADMINISTR.FINANC. LTDA,cancelado
416762,71581599000142,MHZ ADMINISTRAÇÃO E SERVIÇOS DE SAÚDE LTDA.,cancelado
415103,4070141000131,MILENIUM CENTRO DE REABILITACAO ODONTOLOGICA LTDA,cancelado
31769,21883244000130,MINAS DO ITACOLOMY LTDA,cancelado
40137,2728843000134,MINAS PRAIA SAÚDE LTDA,cancelado
38653,19791896000100,MINASGAS S/A DISTRIBUIDORA DE GAS COMBUSTIVEL,cancelado
413569,2846478000162,MIXSISTEM SERVICOS E CONVENIOS LTDA.,cancelado
418293,13264327000112,MN ADMINISTRADORA DE BENEFÍCIOS,cancelado
40327,74502428000179,MOGI CLINIC ASSISTENCIA ODONTOLOGICA S/C LTDA,cancelado
323896,44731628000132,MOGIANO TRANSPORTE GERAIS LTDA,cancelado
354741,48098909000150,MOGIDONTO PLANOS ODONTOLÓGICOS LTDA,cancelado
417521,11545566000115,MOINHOS DE VENTO PLANOS DE SAÚDE LTDA,cancelado
31754,20466512000155,"MONTEC - MONTAGENS, CONTRUÇOES, INDUSTRIA E COMÉRCIO LTDA",cancelado
420131,17278612000143,MONTREALSEG ADMINISTRADORA DE BENEFÍCIOS LTDA,cancelado
413976,4496660000166,MOUNT MCKINLEY SISTEMAS DE SAÚDE LTDA.,cancelado
383945,2793251000104,MS ASSISTÊNCIA MÉDICA S/C LTDA,cancelado
418951,15300953000142,MS PARTICIPAÇÕES LTDA,cancelado
318329,1829179000157,MULT LIFE LTDA,cancelado
417360,9101887000189,MULT-GROUP OPERADORA DE PLANOS DE SAUDE LTDA-ME,cancelado
414824,1289858000180,MULTI CENTER SAUDE LTDA,cancelado
409367,1739072000118,MULTI-ORAL ADMINISTRAÇÃO DE CONVÊNIOS S/C LTDA,cancelado
353221,59105999000186,MULTIBRAS S/A,cancelado
348732,71558258000156,MULTICARE SAÚDE LTDA,cancelado
362450,86897840000114,MULTICLINICA MEDICINA DO TRABALHO LTDA,cancelado
354554,90403874000182,MULTICLINICA SERVICOS DE SAUDE LTDA,cancelado
410675,2329279000187,MULTICOOPER MARANHÃO COOPERATIVA INTEGRADA DE ATIVIDADES MÚLTIPL,cancelado
6726,34265215000156,MULTIPLIC SEGURADORA S/A,cancelado
352870,1585080000157,MULTMEDIC ASSIST. MEDICA E ODONTOLOGICA POR CREDENCIAMENTO LTDA,cancelado
411876,2668864000101,MULTPLUS ADMINISTRACAO DE PLANOS ODONTOLOGICOS S/C LTDA,cancelado
30915,148144000190,MULTPREV COMÉRCIO DE POSTOMO E SERVIÇOS MÉDICOS LTDA ME,cancelado
407674,3308063000106,MUNDIAL ASSISTÊNCIA MÉDICA S/C LTDA,cancelado
415618,7441687000140,MVM ODONTOLOGIA EMPRESARIAL LTDA.,cancelado
419087,17855739000188,MÚLTIPLA ADMINISTRADORA DE BENEFÍCIOS LTDA.,cancelado
420034,22168391000190,MÚLTIPLA ADMINISTRAÇÃO DE BENEFÍCIOS LTDA - ME,cancelado
414719,4439845000139,NACIONAL SAUDE ASSISTENCIA MÉDICA LTDA,cancelado
368415,694028000176,NACIONAL SAÚDE ASSISTÊNCIA MÉDICA LTDA,cancelado
347451,17155276000141,NANSEN S/A - INSTRUMENTOS DE PRECISAO,cancelado
422789,38456202000115,NAPRI ADMINISTRADORA DE BENEFICIOS LTDA,cancelado
408727,3419291000145,NATHAN FERNANDES DE ASSUNÇÃO,cancelado
330612,1470857000138,NATOL-NUCLEO DE ATENDIMENTO ODONTOLOGICO LOCALIZADO S/C LTDA,cancelado
308412,71673990000177,NATURA COSMÉTICOS S/A,cancelado
371041,49074412000246,NEC DO BRASIL S/A,cancelado
413712,4183447000102,NEIVA REJANI JAHN,cancelado
422525,5851063000175,NEO SERVIÇOS PLANOS ODONTOLÓGICOS LTDA,cancelado
412627,4027727000113,NEOCLINIC ODONTOLOGIA  LTDA,cancelado
418153,11567517000183,NEOPLAN - PLANO DE EXCELÊNCIA EM ODONTOLOGIA LTDA,cancelado
321010,60409075000152,NESTLE BRASIL LTDA,cancelado
302431,60409075042408,NESTLÉ INDUSTRIAL E COMERCIAL  LTDA,cancelado
353914,60409075000667,NESTLÉ INDUSTRIAL E COMERCIAL LTDA,cancelado
409685,25700568000146,NEURO MATER LTDA,cancelado
40263,48897607000142,NEUROCLIN S/C LTDA.,cancelado
415456,3459847000127,NEW ODONTO ADMINISTRAÇÃO DE CONVÊNIOS ODONTOLÓGICOS LTDA.,cancelado
402648,2240192000139,NEW-CLEAN-DENT ASSISTENCIA ODONTOLOGICA S/C LTDA,cancelado
421791,32906385000147,NEWCARE ADMINISTRADORA DE BENEFICIOS DE SAUDE LTDA.,cancelado
370762,1500571000158,NGO - CONSULTORIA E ADMINISTRAÇÃO LTDA.,cancelado
408808,34003000146,NIDODONTO ASSISTENCIA ODONTOLOGICA EMPRESARIAL S/C LTDA,cancelado
419451,2211072000103,NIPON DENTAL CONVÊNIO ODONTOLÓGICO LTDA,cancelado
416681,9256457000136,NM - NEUROCARDIO E MEMORIAL SAÚDE LTDA.,cancelado
5754,85031334000185,NOBRE SEGURADORA DO BRASIL S/A,cancelado
300683,70245212000114,NORCLÍNICAS SISTEMA DE SAÚDE LTDA.,cancelado
38563,1345614000178,NORONHA E NORONHA S/C LTDA.,cancelado
408395,1407272000173,NORTE PLANO DO BRASIL S/C LTDA,cancelado
413461,3678090000162,NORTEPLANO PREST SERV E CONV ODONT E MÉDICO S/C LTDA,cancelado
6980,62498803000175,NOTRE DAME SEGURADORA S/A,cancelado
400131,76147727000168,NOVA AMÉRICA CLUBE CULTURA E ASSISTÊNCIA,cancelado
422665,39473593000149,NOVA ODONTO LTDA - EM LIQUIDAÇÃO EXTRAJUDICIAL,cancelado
412821,3801124000164,NOVA ODONTOLOGIA OPERADORA DE PLANOS DE ASSISTÊNCIA ODONTOLOGICA LTDA,cancelado
330353,77790228000157,NOVACLINICA SERVICOS MEDICOS LTDA,cancelado
382108,60561800000103,NOVELIS DO BRASIL LTDA.,cancelado
6092,91677682000127,NOVO HAMBURGO CIA DE SEGUROS GERAIS,cancelado
408573,2310387000108,NOVO PERFIL REPRESENTAÇÕES E ASSESSORIA EM INTERMEDIAÇÃO DE NEGÓCIOS,cancelado
329771,1724522000107,NOVO TEMPO ASSISTENCIA MÉDICA E ODONTOLOGICA S/C LTDA,cancelado
40302,1441000000190,NST SERVIÇOS DE SAÚDE S/C LTDA,cancelado
359866,1855799000160,NUCLEO ASSISTENCIA ODONTOLOGICA LTDA,cancelado
416185,2806968000135,NUCLEO ODONTOLOGICO E PLANO DE ASSIST ODONTOL S/S LTDA,cancelado
401358,2568423000138,NUCLEODONTO PLANOS ODONTOLÓGICOS SOCIEDADE CIVIL LTDA.,cancelado
339555,30022727000130,NUCLEOS INSTITUTO DE SEGURIDADE SOCIAL,cancelado
417645,11925725000107,NUNES & GROSSI ADMINISTRADORA DE BENEFICIOS E SERVIÇOS LTDA,cancelado
414468,1729345000143,O. T. PLANOS ODONTOLÓGICOS LTDA.,cancelado
404365,52364197000141,O.S ODONTOLÓGICA LTDA.,cancelado
343587,91365718000137,OASE - ORDEM AUXILIADORA DE SENHORAS EVANGÉLICAS DE MONTENEGRO,cancelado
359980,52941614000171,OBRA UNIDA A SOCIEDADE SÃO VICENTE DE PAULO,cancelado
405591,61877387000153,ODA ODONTO CENTER S/C LTDA.,cancelado
408271,2056488000102,ODMED SERVIÇOS ODONTOLÓGICOS LTDA,cancelado
407216,2263875000101,ODONTIC S/C LTDA,cancelado
404462,61576138000128,ODONTIL SERVIÇOS ODONTOLÓGICOS S/C LTDA.,cancelado
416126,2256665000196,ODONTO - PLUS CONVÊNIOS ODONTOLÓGICOS LTDA.,cancelado
384739,1750026000110,ODONTO - TAL SERVIÇOS ODONTOLÓGICOS S/C LTDA,cancelado
375454,1593155000141,ODONTO 4 SERVICOS ODONTOLOGICOS S/C LTDA,cancelado
33129,53708863000184,ODONTO A - ASSISTÊNCIA ODONTOLÓGICA S/C LTDA.,cancelado
414875,5740370000189,ODONTO BELLI LTDA,cancelado
409642,627021000131,ODONTO BONNO LTDA.,cancelado
410641,61868000100,ODONTO BRASIL ASSISTÊNCIA ODONTOLÓGICA S/C LTDA.,cancelado
419346,4556810000180,ODONTO CARD - ASSISTENCIA ODONTOLOGICA LTDA - EPP,cancelado
410276,161673000123,ODONTO CENTER S/C LTDA,cancelado
404624,3081121000101,ODONTO CLINICA G ASSISTÊNCIA ODONTOLÓGICA S/C LTDA.,cancelado
409944,90487661000186,ODONTO CLÍNICA LTDA,cancelado
405973,2238710000180,ODONTO CORPUS S/S LTDA.,cancelado
378348,185927000143,ODONTO HEALTH - ASSISTENCIA ODONTOLÓGICA LTDA.,cancelado
412571,3852155000144,ODONTO LINE S/C LTDA.,cancelado
405531,2744351000132,ODONTO LITORAL LTDA,cancelado
414964,6112867000115,ODONTO MAGIC SERVIÇOS ODONTOLÓGICOS LTDA.,cancelado
404934,2507811000109,ODONTO MASTER PLANOS ODONTOLÓGICOS S/C LTDA,cancelado
405507,275422000170,ODONTO MASTER SERVICOS ODONTOLOGICOS LTDA,cancelado
404101,3068805000165,ODONTO MEC  ASSISTENCIA ODONTOLOGICA S/C LTDA,cancelado
415502,5116153000112,ODONTO MÉDICA  LTDA. ME,cancelado
416479,5966517000153,ODONTO NEWS CONSULTÓRIO ODONTOLÓGICO LTDA.,cancelado
404250,1958525000105,ODONTO ORTO PERIO CLINIC ASSISTENCIA ODONTOLOGICA S/C LTDA,cancelado
416851,2256665000196,ODONTO PLUS CONVÊNIOS ODONTOLÓGICOS LTDA,cancelado
37201,1363825000133,ODONTO PREST- SERVICE S/C LTDA,cancelado
420212,25241547000100,ODONTO PRIME PLANOS ODONTOLÓGICOS LTDA ME,cancelado
414107,3842935000103,ODONTO PRÓTESE PLANOS DE ASSISTÊNCIA ODONTOLÓGICA LTDA,cancelado
416347,7335693000112,ODONTO QUALIT SERVIÇOS ODONTOLÓGICOS LTDA,cancelado
400041,2134984000129,ODONTO QUALITY SERVIÇOS,cancelado
366978,65695199000165,ODONTO SAMP ASSISTÊNCIA ODOTOLÓGICA S/C LTDA,cancelado
411353,3725245000174,ODONTO SANTA CATARINA CONVENIOS LTDA,cancelado
411329,3695214000118,ODONTO SAUDE LTDA,cancelado
405965,2539613000127,ODONTO SAÚDE COOP. DE TRAB. ODONTOLÓGICOS DE PEDRO LEOPOLDO,cancelado
406627,3261415000107,ODONTO SAÚDE INTEGRADA S/C LTDA,cancelado
40349,126507000196,ODONTO SAÚDE LTDA,cancelado
412465,1852366000151,ODONTO SAÚDE PLANO DE SAÚDE ODONTOLÓGICA LTDA,cancelado
414808,5807546000172,ODONTO SAÚDE SERVIÇOS DE ODONTOLOGIA LTDA.,cancelado
360813,40932741000125,ODONTO SERV LTDA.,cancelado
408816,1604483000104,ODONTO SERVICE ASSISTENCIA ODONTOLOGICA S/S  LTDA.,cancelado
412104,1873817000137,ODONTO SUL LTDA,cancelado
334588,23595762000183,ODONTO SYSTEM PLANOS ODONTOLOGICOS LTDA,cancelado
340227,57266116000194,ODONTO SÃO LUCAS LTDA.,cancelado
414841,86693215000150,ODONTO TIME ASSISTÊNCIA ODONTOLÓGICA LTDA,cancelado
35415,69117125000100,ODONTO-CARD ASSISTENCIA ODONTOLOGICA S/C LTDA.,cancelado
409928,2263364000190,ODONTO-CLIN CLINICA ODONTOLOGICA LTDA,cancelado
33196,1859656000127,ODONTO-NEWS PLANOS DE SAÚDE ODONTOLÓGICA S/C LTDA.,cancelado
402532,1720362000110,ODONTO-PLAN SERVIÇOS ODONTOLOGICOS LTDA,cancelado
408042,1796922000110,ODONTO-PREV ASSISTÊNCIA ODONTOLÓGICA LTDA.,cancelado
400921,2544243000116,ODONTO-SAÚDE ASSISTÊNCIA ODONTOLÓGICA LTDA,cancelado
316971,74495177000142,ODONTO-SERT SERVIÇOS ODONTOLÓGICOS S/S LTDA.,cancelado
404764,3098435000109,ODONTO100 ASSISTENCIA ODONTOLOGICA S/C LTDA,cancelado
414336,4708133000178,ODONTOASSIST ASSISTENCIA ODONTOLOGICA LTDA.,cancelado
402214,1293923000141,ODONTOBET LTDA,cancelado
407089,73941601000172,ODONTOBRÁS PARTICIPAÇÕES SERVIÇOS E CONVÊNIOS LTDA,cancelado
330841,1852355000171,ODONTOCAMP ASSISTÊNCIA ODONTOLÓGICA LTDA.,cancelado
405060,1088281000149,ODONTOCAP SERVIÇOS ODONTOLÓGICOS S/S LTDA.,cancelado
401382,398566000113,ODONTOCARD CLÍNICA DE ASSIST.E SERVIÇOS ODONTOLÓGICOS LTDA.,cancelado
421596,23108333000134,ODONTOCEL OPERADORA DE PLANOS ODONTOLÓGICOS LTDA - ME,cancelado
404781,1512578000190,ODONTOCENTER PLANTÃO 24 HORAS LTDA,cancelado
412066,3867237000162,ODONTOCLASS ASSISTENCIA ODONTOLOGICA LTDA,cancelado
410403,3505863000109,ODONTOCLASS LTDA,cancelado
406694,3060819000132,ODONTOCLEAN PLUS ASSISTÊNCIA ODONTOLÓGICA S/C LTDA.,cancelado
412937,3987415000199,ODONTOCLEAR PLANOS ODONTOLOGICOS LTDA,cancelado
409715,2931607000110,ODONTOCLIN - ODONTOLOGIA CLÍNICA INTEGRADA,cancelado
415669,4350828000120,ODONTOCLIN CLINICA ODONTOLOGICA LTDA,cancelado
313165,45698693000176,ODONTOCLIN SERVIÇOS ODONTOLÓGICOS LTDA,cancelado
409332,3430426000173,ODONTOCLIN SERVIÇOS ODONTOLÓGICOS LTDA,cancelado
401111,46233821000179,ODONTOCLINICAS S/C LTDA,cancelado
406155,3045653000185,ODONTOCLÍNICA SORRISO LTDA,cancelado
406848,2897620000109,ODONTOCOOP - COOPERATIVA DE TRABALHO ODONTOLÓGICO,cancelado
406490,3010356000102,ODONTOCROSS LTDA - EPP,cancelado
301850,62481619000112,ODONTODHAN OPERADORA ODONTOLÓGICA LTDA.,cancelado
415367,2399661000167,ODONTOFACE ASSISTÊNCIA ODONTOLÓGICA LTDA.,cancelado
417068,2399661000167,ODONTOFACE OPERADORA DE PLANOS DE SAUDE ODONTOLOGICOS LTDA,cancelado
414433,5087666000142,ODONTOFEM - ODONTOLOGIA FAMILIAR E EMPRESARIAL S/C LTDA,cancelado
400076,2100086000150,ODONTOGRAFH RADIOLOGIA E DOCUMENTAÇÃO ODONTOLÓGICA S/C LTDA.,cancelado
40273,2047957000119,ODONTOITEGRUN ASSOCIATION S/C LTDA,cancelado
401790,3010182000170,ODONTOLIFE COMERCIO DE MATERIAIS E ASSISTENCIA ODONTOLOGICA LTDA,cancelado
414140,3599118000176,ODONTOLIFE S/C LTDA.,cancelado
414859,5151581000186,ODONTOLINE PLANO DE SAUDE ODONTOLOGICO LTDA,cancelado
415219,3164734000102,ODONTOLOGIA K  SORRISO LTDA.,cancelado
411221,2779442000103,ODONTOLOGIA MARIN,cancelado
407836,66228628000157,ODONTOLOGIA PREVENTIVA E ASSISTENCIA MEDICA LTDA,cancelado
407127,2771638000151,ODONTOLOGIC ASSISTENCIA ODONTOLOGICA S/C LTDA,cancelado
412473,1705589000196,ODONTOLOGICA CLÍNICA DENTÁRIA LTDA,cancelado
406236,539179000150,ODONTOLOGICO SIST. ODONT. EMP. E PART. LTDA,cancelado
416461,5960862000180,ODONTOLOGYC SYSTEM CONVÊNIO ODONTOLOGICO LTDA,cancelado
407437,74873928000117,ODONTOLÓGICA CLINICA DENTÁRIA S/S LTDA.,cancelado
416614,9109375000169,ODONTOLÓGICA SERVIÇOS DE SAÚDE ORAL LTDA,cancelado
416053,5695870000146,ODONTOMAR LTDA.,cancelado
412082,3113218000140,ODONTOMAX - COOPEATIVA DE TRABALHO ODONTOLÓGICO LTDA,cancelado
418251,5287585000196,ODONTOMED SAUDE LTDA - ME,cancelado
406198,3058173000159,ODONTOMED SERVIÇOS ODONTOLÓGICOS LTDA,cancelado
405159,36444438000106,ODONTOMED-CENTRO MÉDICO LTDA,cancelado
412287,3757349000160,ODONTOMEDIC DO BRASIL S/C LTDA,cancelado
413101,2261093000133,ODONTONET ADMINISTRAÇÃO DE PLANOS LTDA.,cancelado
416169,7593653000170,ODONTONOG SERVIÇOS ODONTOLÓGICOS LTDA,cancelado
313891,79447603000196,ODONTOPAM ASSISTENCIA MÉDICA ODONTOLOGICA INTEGRADA LTDA,cancelado
310085,1070498000121,ODONTOPAR ASSISTÊNCIA ODONTOLÓGICA DO PARANÁ S/C LTDA,cancelado
418714,14714412000106,ODONTOPARÁ PLANO DE SAÚDE E CLÍNICA ODONTOLÓGICA LTDA,cancelado
408841,3430940000109,ODONTOPLAN - PLANO DE ASSISTÊNCIA ODONTOLÓGICA LTDA,cancelado
416355,5870140000134,ODONTOPLAN ASSISTÊNCIA ODONTOLÓGICA LTDA,cancelado
404306,51894483000156,ODONTOPLAN ODONTOLOGIA PLANEJADA S/C LTDA,cancelado
423238,45505515000181,ODONTOPLAN PLANOS ODONTOLOGICOS LTDA,cancelado
418668,16526992000125,ODONTOPLANOS PLANOS ODONTOLOGICOS LTDA,cancelado
406171,71557797000170,ODONTOPLASA  ADM.EM SAUDE SOCIEDADE EMPRESARIA LTDA.,cancelado
410781,2035496000164,ODONTOPLUS SISTEMA NACIONAL DE ODONTOLOGIA LTDA,cancelado
416673,3785927000172,ODONTOPONTA CLINICA ODONTOLÓGICA LTDA,cancelado
409090,834097000138,ODONTOPRESS PREST SERV ODONT EMPR LTDA,cancelado
356042,914355000196,ODONTOS UNIDADE ODONTOLOGICA LTDA,cancelado
404683,1903027000157,ODONTOSANUS  ASSISTÊNCIA ODONTOLOGICA  LTDA,cancelado
40339,3022776000109,ODONTOSAÚDE LTDA.,cancelado
409936,2754275000146,ODONTOSERRA - CLÍNICA ODONTOLÓGICA LTDA,cancelado
406562,65248353000150,ODONTOSERV ASSISTÊNCIA ODONTOLÓGICA LTDA,cancelado
401293,1014212000190,ODONTOSUL COOP.DOS CIRURGIÕES DENTISTAS DA REGIAO SERRANA,cancelado
413682,4162241000198,ODONTOVALE ASSISTENCIA ODONTOLOGICA 24 HORAS LTDA.,cancelado
411574,2963220000146,ODONTOVEL CENTRO DE ATENDIMENTO ODONTOLOGICO DE CASCAVEL LTDA,cancelado
409154,1653911000180,ODONTOVIDA ASSISTENCIA ODONTOLOGICA  LTDA,cancelado
410497,2560649000192,ODONTOVIP PLANOS ODONTOLÓGICOS LTDA.,cancelado
422428,37769458000110,ODONTOWAY - PLANOS ODONTOLOGICOS EIRELI,cancelado
415961,2492694000157,ODONTRAT ASSISTENCIA ODONTOLOGICA LTDA. - EIRELI,cancelado
416037,3737518000109,ODONTSAMPT ASSISTENCIA ODONTOLOGICA LTDA,cancelado
411183,1241780000124,ODONTUS - CLÍNICA ODONTOLÓGICA S/C LTDA,cancelado
409219,1865837000166,ODONTUS COOPERATIVA DOS ODONTOLOGOS DO DF,cancelado
412929,2840854000101,ODOUS ODONTOCLINICA LTDA,cancelado
340219,84649821000143,OM OPERADORA DE PLANOS PRIVADOS DE ASSISTÊNCIA À SAÚDE LTDA.,cancelado
401447,2836705000179,OMEGA DO CEARÁ - COOP. DE TRABALHO ODONTOLÓGICO LTDA.,cancelado
320471,66668906000197,OMEGHA - SISTEMA ASSISTENCIAL EM ODONTOLOGIA S/C LTDA.,cancelado
35938,2439749000165,ONIODONTO - EMPRESA GERENCIADORA DE SERVIÇOS ODONTOLOGICOS LTDA.,cancelado
422410,27562279000153,OP PRIME CLÍNICA ODONTOLÓGICA,cancelado
382442,42811117000103,OPEM ODONTOLOGIA PARA EMPRESAS S/C LTDA,cancelado
415189,6302584000136,OPEMEG-OPERADORA ESPECIALIZADA EM MEDICINA DE GRUPO LTDA.,cancelado
407950,59949917000180,OPEN LIFE PLANO DE ASSISTÊNCIA MÉDICA HOSPITALAR S/C LTDA,cancelado
400661,1697761000107,OPER RISO ASSISTENCIA ODONTOLOGICA PARTICULAR E EMPRESARIAL SOCIEDADE SIMPLES ,cancelado
319741,2877007000111,OPERADORA DE ASSISTENCIA A SAUDE LTDA,cancelado
414239,3922737000150,OPERADORA DE PLANO DE SAÚDE 100% SAUDÁVEL S/C LTDA.,cancelado
409235,1130185000111,OPERADORA DE PLANOS DE SAÚDE SERRA IMPERIAL LTDA.,cancelado
419681,21553778000106,OPERADORA DE PLANOS ODONTOLOGICOS ORTOBAHIA LTDA,cancelado
350729,2906583000140,OPERADORA DE PLANOS PRIVADOS DE ASSISTENCIA A SAUDE CONSAUDE S/S LTDA - EM LIQUIDAÇÃO EXTRAJUDICIAL,cancelado
409502,3339761000160,OPERADORA DE PLANOS SÃO VICENTE SOC. CIVIL LTDA,cancelado
302813,89546063000313,OPP PETROQUIMICA SA,cancelado
413631,4288864000101,OPS - PLANOS DE SAÚDE S.A,cancelado
416142,3505750000103,OPSFELDER ASSESSORIA S/S LTDA,cancelado
32731,69900975000172,OPÇÃO ADMINISTRADORA DE SAÚDE LTDA.,cancelado
413127,3471880000172,ORAL BRASIL CONSULTORIA E GESTÃO EM SAÚDE LTDA,cancelado
407747,2976164000184,ORAL CAN - ODONTOLÓGICA S/C LTDA,cancelado
400068,1163889000190,ORAL CLÍNICAS S/C LTDA.,cancelado
416606,8846048000127,ORAL CORPORATE ASSISTÊNCIA ODONTOLÓGICA LTDA,cancelado
401595,2960065000104,ORAL FLEX CONVÊNIO E PRESTAÇÃO DE SERVIÇOS ODONTOLÓGICOS S/S LTDA,cancelado
300951,56463441000184,ORAL HEALTH SISTEMA INTEGRADO DE ASSISTÊNCIA ODONTOLÓGICA LTDA,cancelado
404861,2346725000161,ORAL KIDS CLINICA ODONTOLOGICA SC LTDA.,cancelado
422649,39709534000127,ORAL LIFE PLANO ODONTOLOGICO LTDA,cancelado
409162,2189226000108,ORAL LINE CONVÊNIOS ODONTOLÓGICOS LTDA,cancelado
406376,1638249000190,ORAL LÍDER ASSISTENCIAL ODONTOLÓGICA S/C LTDA,cancelado
415880,7468931000168,ORAL MAXIPREV PLANOS ODONTOLÓGICOS LTDA.,cancelado
395340,47835301000107,ORAL MED ASSISTENCIA ODONTOLOGICA S/A,cancelado
362352,95373346000141,ORAL MED PARANÁ-CLÍNICA ODONTOLÓGICA LTDA,cancelado
304034,96538228000109,ORAL ODONTO ASSISTÊNCIA ODONTOLÓGICA LTDA,cancelado
326348,59239772000123,ORAL PERSONAL ADMINISTRADORA ODONTOLOGICA S/C LTDA,cancelado
411655,3811026000108,ORAL PREMIUM S/S LTDA,cancelado
40347,2846833000101,ORAL PREV - PLANO DE ASSIST. ODONTOLÓGICA LTDA,cancelado
31975,217603000140,ORAL PREVENT ASSISTÊNCIA ODONTOLÓGICA S/C LTDA.,cancelado
340073,2562675000150,ORAL SAÚDE ADMINISTRAÇÃO DE CONVÊNIOS S/C LTDA,cancelado
311693,2479891000136,ORAL SAÚDE CLÍNICA ODONTOLÓGICA LTDA.,cancelado
413151,4170133000167,ORAL SAÚDE DE RESENDE SERVIÇOS ODONTOLÓGICOS LTDA,cancelado
379557,1656711000181,ORAL SAÚDE DE VOTUPORANGA SERVIÇO ODONTOLÓGICO LTDA.,cancelado
411680,3556378000164,ORAL SAÚDE PATOS DE MINAS SERV. ODONTOLÓGICOS S/C LTDA,cancelado
401455,251808000141,ORAL SAÚDE SERVIÇOS ODONTOLÓGICOS S/S LTDA,cancelado
359807,1653223000110,ORAL SOLUTION ADM. PLANOS ODONT. S/C LTDA,cancelado
401498,1832277000143,ORAL STAR  ASSISTENCIA ODONTOLOGICA LTDA,cancelado
306517,46232609000197,ORAL SYSTEM ASSISTENCIA ODON GLOBAL L. ESCOLHA S/C LTDA,cancelado
406244,534741000152,ORAL SYSTEM ASSISTENCIA ODONTOLOGICA LTDA,cancelado
413771,1745586000186,ORAL VIDA ASSISTÊNCIA ODONTOLÓGICA LTDA.,cancelado
40008,1172013000100,ORAL WEST ASSISTÊNCIA ODONTOLÓGICA S/C LTDA.,cancelado
403890,74242538000149,ORALCARD - ASSISTÊNCIA ODONTOLÓGICA E COMÉRCIO LTDA,cancelado
402478,303696000125,ORALCLASS ASSISTENCIA MÉDICA E ODONTOLOGICA LTDA. - EM LIQUIDAÇÃO EXTRAJUDICIAL,cancelado
407151,2188892000121,ORALCLIN CLINICA ODONTOLÓGICA LTDA,cancelado
308960,1298761000134,ORALGOLD ASSISTÊNCIA ODONTOLÓGICA LTDA,cancelado
403300,58794405000129,ORALGOLD PLANOS ODONTOLÓGICOS S.A,cancelado
320579,2476276000176,ORALMEDI CLINICA MÉDICA S/C LTDA,cancelado
